"id","score","title","summary","venue","year","authors","citationCount","referenceCount","influentialCitationCount","url"
"fa5b139b08ef9ce0529d68c929f786412edc2898",1,"JuICe: A Large Scale Distantly Supervised Dataset for Open Domain Context-based Code Generation","To study code generation conditioned on a long context history, JuICe is presented, a corpus of 1.5 million examples with a curated test set of 3.7K instances based on online programming assignments that provides refined human-curated data, open-domain code, and an order of magnitude more training data.","Conference on Empirical Methods in Natural Language Processing",2019,"R. Agashe,Srini Iyer,Luke Zettlemoyer",34,33,9,"https://www.semanticscholar.org/paper/fa5b139b08ef9ce0529d68c929f786412edc2898"
"5ad7ce7810964bde2c86e07d63156270e0b17e0b",1,"Extracting Code-relevant Description Sentences Based on Structural Similarity","To quantify the relevance between code line and natural language sentence, the authors represent them with structure trees and calculate their structural similarity.","Asia-Pacific Symposium on Internetware",2019,"Yingkui Cao,Yanzhen Zou,Bing Xie",0,49,0,"https://www.semanticscholar.org/paper/5ad7ce7810964bde2c86e07d63156270e0b17e0b"
"539268757e7d29201a13e5ca90454eb151d3d022",1,"Abstraction, Generalization, and Embodiment in Neural Program Synthesis","This paper presents a meta-modelling framework that automates the very labor-intensive and therefore time-heavy and expensive process of designing and implementing neural program Synthesis systems.","",2020,"Richard Shin",0,129,0,"https://www.semanticscholar.org/paper/539268757e7d29201a13e5ca90454eb151d3d022"
"fd551f9b634b43b4b6be6fbda8369f95868ae94a",1,"POSIT: Simultaneously TaggingNatural and Programming Languages","This paper borrows code-switching techniques from Natural Language Processing and adapt them to apply to mixed text to solve two problems: language identification and token tagging, and develops POSIT, a technique that improves the state-of-the-art on language identification by 10.6% and PoS/AST tagging by 23.7% in accuracy.","",2020,"Profir-Petru Pârt",0,35,0,"https://www.semanticscholar.org/paper/fd551f9b634b43b4b6be6fbda8369f95868ae94a"
"d6fef46fd53c3bb13dc2cd32d8b8050b3f67058c",1,"Neural Semantic Parsing for Syntax-Aware Code Generation","This thesis presents an efficient neural semantic parser that exploits the underlying grammar of logical forms to enforce well-formed expressions and shows that the proposed model outperforms the standard encoder-decoder model across datasets and is competitive with comparable grammar-guided semantic parsing approaches.","",2020,"Artur Baranowski",0,68,0,"https://www.semanticscholar.org/paper/d6fef46fd53c3bb13dc2cd32d8b8050b3f67058c"
"1f8885c1dea94b97be0d0a89afe642c37ebfbc55",1,"Learning Based Methods for Code Runtime Complexity Prediction","This work model this problem as a machine learning task and check its feasibility with thorough analysis, establishing baselines using two different approaches: feature engineering and code embeddings, to achieve state of the art results and compare their performances.","European Conference on Information Retrieval",2019,"Jagriti Sikka,K. Satya,Yaman Kumar Singla,Shagun Uppal,R. Shah,Roger Zimmermann",2,17,0,"https://www.semanticscholar.org/paper/1f8885c1dea94b97be0d0a89afe642c37ebfbc55"
"a470dfc3dd30e4a27c8480d6fb817ece6a11d813",1,"Associating Natural Language Comment and Source Code Entities","A binary classifier and a sequence labeling model is developed by crafting a rich feature set which encompasses various aspects of code, comments, and the relationships between them and shows that these systems outperform several baselines learning from the proposed supervision.","AAAI Conference on Artificial Intelligence",2019,"Sheena Panthaplackel,Miloš Gligorić,R. Mooney,Junyi Jessy Li",14,39,0,"https://www.semanticscholar.org/paper/a470dfc3dd30e4a27c8480d6fb817ece6a11d813"
"b68f2d939ea3acaf4bee6a487522c27ef7d04cee",1,"Are the Code Snippets What We Are Searching for? A Benchmark and an Empirical Study on Code Search with Natural-Language Queries","This paper builds CosBench, a dataset that consists of 1000 projects, 52 code-independent natural-language queries with ground truths, and a set of scripts for calculating four metrics on code research results, and evaluated four IR (Information Retrieval)-based and two DL (Deep Learning)-based code search methods on CosBench.","IEEE International Conference on Software Analysis, Evolution, and Reengineering",2020,"Shuhan Yan,Hang Yu,Yuting Chen,Beijun Shen,Lingxiao Jiang",29,51,1,"https://www.semanticscholar.org/paper/b68f2d939ea3acaf4bee6a487522c27ef7d04cee"
"0dfe706526e5234338411489e1826b4060acc4e8",1,"CC2Vec: Distributed Representations of Code Changes","This work proposed CC2Vec, a neural network model that learns a representation of code changes guided by their accompanying log messages, which represent the semantic intent of the code changes, which outperform the state-of-the-art techniques.","International Conference on Software Engineering",2020,"Thong Hoang,Hong Jin Kang,J. Lawall,David Lo",77,70,18,"https://www.semanticscholar.org/paper/0dfe706526e5234338411489e1826b4060acc4e8"
"3944354c42ddfff7414ad06022f96c72858d5fa6",1,"Big Code != Big Vocabulary: Open-Vocabulary Models for Source Code","This paper presents an open vocabulary source code NLM that can scale to such a corpus, 100 times larger than in previous work; and shows that such models outperform the state of the art on three distinct code corpora (Java, C, Python).","International Conference on Software Engineering",2020,"Rafael-Michael Karampatsis,Hlib Babii,R. Robbes,Charles Sutton,A. Janes",149,95,27,"https://www.semanticscholar.org/paper/3944354c42ddfff7414ad06022f96c72858d5fa6"
"5e9b611a476e993f03c90424847311cd84e36a06",1,"Optimising the fit of stack overflow code snippets into existing code","An automated code reuse tool for the Eclipse IDE, NLP2TestableCode, which can not only search for Java code snippets using natural language tasks, but also evaluate code snippets based on a user's existing code, modify snippets to improve fit and correct errors, before presenting the user with the best snippet, all without leaving the editor.","GECCO Companion",2020,"Brittany Reid,Christoph Treude,Markus Wagner",6,25,0,"https://www.semanticscholar.org/paper/5e9b611a476e993f03c90424847311cd84e36a06"
"77910e51a40d17157fc798325d06edfa6cff18d6",1,"Incorporating External Knowledge through Pre-training for Natural Language to Code Generation","Evaluations show that combining the two sources with data augmentation and retrieval-based data re-sampling improves the current state-of-the-art by up to 2.2% absolute BLEU score on the code generation testbed CoNaLa.","Annual Meeting of the Association for Computational Linguistics",2020,"Frank F. Xu,Zhengbao Jiang,Pengcheng Yin,Bogdan Vasilescu,Graham Neubig",50,31,9,"https://www.semanticscholar.org/paper/77910e51a40d17157fc798325d06edfa6cff18d6"
"57348a5e75b89c1d3e8d5b85027872c35ebc6d36",1,"Relevance Transformer: Generating Concise Code Snippets with Relevance Feedback","The Relevance Transformer model shows the potential of Transformer-based architectures for code generation and introduces a method of incorporating pseudo-relevance feedback during inference, shown over state-of-the-art methods based on BLEU evaluation.","Annual International ACM SIGIR Conference on Research and Development in Information Retrieval",2020,"Carlos Gemmell,Federico Rossetto,Jeffrey Dalton",8,21,2,"https://www.semanticscholar.org/paper/57348a5e75b89c1d3e8d5b85027872c35ebc6d36"
"a266b37f98928f27fddd863d11b38a5563043315",1,"Learning to Update Natural Language Comments Based on Code Changes","This work proposes an approach that learns to correlate changes across two distinct language representations, to generate a sequence of edits that are applied to the existing comment to reflect the source code modifications.","Annual Meeting of the Association for Computational Linguistics",2020,"Sheena Panthaplackel,Pengyu Nie,Miloš Gligorić,Junyi Jessy Li,R. Mooney",40,42,4,"https://www.semanticscholar.org/paper/a266b37f98928f27fddd863d11b38a5563043315"
"037aa837d95b5f0edef494a2392b1788dc840a47",1,"A Multi-Perspective Architecture for Semantic Code Search","A novel multi-perspective cross-lingual neural framework for code–text matching is proposed, inspired in part by a previous model for monolingual text-to-text matching, to capture both global and local similarities.","Annual Meeting of the Association for Computational Linguistics",2020,"Rajarshi Haldar,Lingfei Wu,Jinjun Xiong,J. Hockenmaier",23,13,3,"https://www.semanticscholar.org/paper/037aa837d95b5f0edef494a2392b1788dc840a47"
"eccd7060c4f81e92d65601f5c7ac7cade2f68807",1,"TAG : Type Auxiliary Guiding for Code Comment Generation","A Type Auxiliary Guiding encoder-decoder framework for the code comment generation task which considers the source code as an N-ary tree with type information associated with each node and a hierarchical reinforcement learning method to resolve the training difficulties of this proposed framework.","Annual Meeting of the Association for Computational Linguistics",2020,"Ruichu Cai,Zhihao Liang,Boyan Xu,Zijian Li,Yuexing Hao,Yao Chen",14,40,2,"https://www.semanticscholar.org/paper/eccd7060c4f81e92d65601f5c7ac7cade2f68807"
"c9aac0037e8abe2da081490cc9d10610aa8fdb3f",1,"Semantic code search using Code2Vec: A bag-of-paths model","This thesis uses Code2Vec, a model that learns distributed representations of source code called code embeddings, to evaluate its performance against the task of semantically searching code snippets to create a hybrid model that outperforms previous benchmark baseline models developed in the CodeSearchNet challenge.","",2020,"Lakshmanan Arumugam",4,46,0,"https://www.semanticscholar.org/paper/c9aac0037e8abe2da081490cc9d10610aa8fdb3f"
"0a01de6020e43db362e92664d1832a488d4a4c5b",1,"Improving Quality of a Post’s Set of Answers in Stack Overflow","An approach to automate the identification process of deficient posts on Stack Overflow and boost their set of answers, utilizing the help of related experts, and develops an Eclipse plugin named SOPI and integrated the prediction model in the plugin to link these deficient posts to related developers and help them improve the answer set.","EUROMICRO Conference on Software Engineering and Advanced Applications",2020,"M. Tavakoli,M. Izadi,A. Heydarnoori",4,19,0,"https://www.semanticscholar.org/paper/0a01de6020e43db362e92664d1832a488d4a4c5b"
"4e0daa62e8467c46123bc957f0068f7901e1e94f",1,"Mining API usage scenarios from stack overflow","A framework to automatically mine API usage scenarios from Stack Overflow, supported by three novel algorithms is proposed and implemented and deployed in the proof-of-concept online tool, Opiner.","Information and Software Technology",2020,"Gias Uddin,F. Khomh,C. Roy",23,108,0,"https://www.semanticscholar.org/paper/4e0daa62e8467c46123bc957f0068f7901e1e94f"
"eeb37b1b3019a03669b9b8b8173efbbd7c236184",1,"POSIT: Simultaneously Tagging Natural and Programming Languages","This paper borrows code-switching techniques from Natural Language Processing and adapt them to apply to mixed text to solve two problems: language identification and token tagging, and produces POSIT, which improves the state-of-the-art on language identification by 10.6% and PoS/Ast tagging by 23.7% in accuracy.","International Conference on Software Engineering",2020,"Profir-Petru Pârtachi,S. K. Dash,Christoph Treude,Earl T. Barr",7,35,0,"https://www.semanticscholar.org/paper/eeb37b1b3019a03669b9b8b8173efbbd7c236184"
"4a7e7b24389d190d20f214054156e43dc269e595",1,"POSIT","","Proceedings of the ACM/IEEE 42nd International Conference on Software Engineering",2020,"Profir-Petru Pârtachi,S. K. Dash,Christoph Treude,Earl T. Barr",1,17,0,"https://www.semanticscholar.org/paper/4a7e7b24389d190d20f214054156e43dc269e595"
"8fbb41e21a8ba6072de60980d3c96e5e50c8e8fa",1,"CC2Vec","","Proceedings of the ACM/IEEE 42nd International Conference on Software Engineering",2020,"Thong Hoang,Hong Jin Kang,D. Lo,Julia L. Lawall",1,35,0,"https://www.semanticscholar.org/paper/8fbb41e21a8ba6072de60980d3c96e5e50c8e8fa"
"ca0810e7658b72cdce6ea807d2ed0ed39ca70d4e",1,"Bug severity prediction using question-and-answer pairs from Stack Overflow","This paper extracts all the posts related to bug repositories from Stack Overflow and combines them with bug reports to obtain enhanced versions of bug reports and achieves severity prediction on three popular open source projects with Naive Bayesian, k-Nearest Neighbor algorithm (KNN), and Long Short-Term Memory (LSTM).","Journal of Systems and Software",2020,"Youshuai Tan,Sijie Xu,Zhaowei Wang,Tao Zhang,Zhou Xu,Xiapu Luo",26,41,1,"https://www.semanticscholar.org/paper/ca0810e7658b72cdce6ea807d2ed0ed39ca70d4e"
"7c41e58832f3af5fd9e09674924d6b5f822e8eac",1,"Exploring Unexplored Generalization Challenges for Cross-Database Semantic Parsing","This work re-purpose eight semantic parsing datasets that have been well-studied in the setting where in-domain training data is available, and instead use them as additional evaluation data for XSP systems instead, to uncovers several generalization challenges for cross-database semantic parsing.","Annual Meeting of the Association for Computational Linguistics",2020,"Alane Suhr,Ming-Wei Chang,Peter Shaw,Kenton Lee",52,62,17,"https://www.semanticscholar.org/paper/7c41e58832f3af5fd9e09674924d6b5f822e8eac"
"f30a7e6a1f7bbaf34493586fa61972a4789f7594",1,"Hierarchical Embedding for Code Search in Software Q&A Sites","A novel deep neural network named HECS 1 (Hierarchical embedding for code search), which can understand the difference between positive and negative samples more accurately and achieves state-of-the-art performance.","IEEE International Joint Conference on Neural Network",2020,"Ruitong Li,Gang Hu,Min Peng",0,35,0,"https://www.semanticscholar.org/paper/f30a7e6a1f7bbaf34493586fa61972a4789f7594"
"b5b9ed1e6d3cd2e51d155831cdfae39f2e0f4578",1,"Synergy between Machine/Deep Learning and Software Engineering: How Far Are We?","A 10-year Systematic Literature Review on 906 ML/DL-related SE papers published between 2009 and 2018 demonstrated the mutual impacts that ML/ DL and SE have had on each other and identified five factors that influence their replicability and reproducibility.","ArXiv",2020,"Simin Wang,LiGuo Huang,Jidong Ge,Tengfei Zhang,Haitao Feng,Ming Li,He Zhang,Vincent Ng",3,155,0,"https://www.semanticscholar.org/paper/b5b9ed1e6d3cd2e51d155831cdfae39f2e0f4578"
"2dc59238ad0f010f505238fcd0dd0695681200ef",1,"Neural Code Search Revisited: Enhancing Code Snippet Retrieval through Natural Language Intent","A domain-specific retrieval model for code annotated with a natural language description is created that yields significantly more relevant search results compared to state-of-the-art code retrieval methods that do not use descriptions.","ArXiv",2020,"Geert Heyman,T. V. Cutsem",15,31,3,"https://www.semanticscholar.org/paper/2dc59238ad0f010f505238fcd0dd0695681200ef"
"d944bf7942297f5670192c5cd33191c26a87973e",1,"Code to Comment “Translation”: Data, Metrics, Baselining & Evaluation","It is argued that fairly naive information retrieval methods do well enough at this task to be considered a reasonable baseline, and some suggestions on how the findings might be used in future research in this area are made.","International Conference on Automated Software Engineering",2020,"David Gros,Hariharan Sezhiyan,Prem Devanbu,Zhou Yu",38,64,2,"https://www.semanticscholar.org/paper/d944bf7942297f5670192c5cd33191c26a87973e"
"179076fe7aad3d5f085535b37bae85cbbae3c240",1,"CROKAGE: effective solution recommendation for programming tasks by leveraging crowd knowledge","The proposed CROKAGE (CrowdKnowledge Answer Generator), a tool that takes the description of a programming task as input and delivers a comprehensible solution for the task, outperforms the state-of-art tool in terms of relevance of the suggested code examples, benefit of the code explanations and the overall solution quality.","Empirical Software Engineering",2020,"R. F. Silva,C. Roy,M. M. Rahman,Kevin A. Schneider,K. V. R. Paixão,C. E. Dantas,M. Maia",7,75,1,"https://www.semanticscholar.org/paper/179076fe7aad3d5f085535b37bae85cbbae3c240"
"c6f608a3731a1fde355835a0e10a65ac71f80643",1,"Towards Full-line Code Completion with Neural Language Models","This paper conducts experiments on two real-world python corpora and evaluates existing neural models based on source code tokens or syntactical actions and shows that neural language models can achieve acceptable results on the authors' tasks, with significant room for improvements.","ArXiv",2020,"Wenhan Wang,Sijie Shen,Ge Li,Zhi Jin",7,26,0,"https://www.semanticscholar.org/paper/c6f608a3731a1fde355835a0e10a65ac71f80643"
"e6e8a2c56243847b77b604259cde9e10a2daccb8",1,"Semantic Evaluation for Text-to-SQL with Distilled Test Suite","This work proposes test suite accuracy to approximate semantic accuracy for Text-to-SQL models by distilling a small test suite of databases that achieves high code coverage for the gold query from a large number of randomly generated databases.","Conference on Empirical Methods in Natural Language Processing",2020,"Ruiqi Zhong,Tao Yu,D. Klein",26,44,3,"https://www.semanticscholar.org/paper/e6e8a2c56243847b77b604259cde9e10a2daccb8"
"3421e608d478161146d795752b6bcd222ed4c106",1,"When Does it Pay Off to Learn a New Skill? Revealing the Complementary Benefit of Cross-Skilling","The results indicate that the added economic value of learning a new skill strongly depends on the already existing skill bundle but that acquiring a skill from a different domain is often beneficial.","SSRN Electronic Journal",2020,"F. Stephany",6,113,0,"https://www.semanticscholar.org/paper/3421e608d478161146d795752b6bcd222ed4c106"
"f0a9ff1391bdefaf6d712e5c27e747d7d710bb40",1,"AlgoLabel: A Large Dataset for Multi-Label Classification of Algorithmic Challenges","This work proposes a large multi-modal dataset of text and code pairs consisting of algorithmic challenges and their solutions, called AlgoLabel and proposes a dual text-code neural model for detecting the algorithmic solution type for a programming challenge.","Mathematics",2020,"R. Iacob,V. Monea,D. Radulescu,Andrei-Florin Ceapă,Traian Rebedea,Stefan Trausan-Matu",1,52,0,"https://www.semanticscholar.org/paper/f0a9ff1391bdefaf6d712e5c27e747d7d710bb40"
"2df83c8604ac9260a77d85241b9da0539b29effa",1,"Statistical machine translation outperforms neural machine translation in software engineering: why and how","This work provides a hypothesis that SE corpus has inherent characteristics that NMT will confront challenges compared to the state-of-the-art translation engine based on Statistical Machine Translation, and implements and optimize the original SMT and NMT to mitigate those challenges.","",2020,"H. Phan,A. Jannesari",7,48,0,"https://www.semanticscholar.org/paper/2df83c8604ac9260a77d85241b9da0539b29effa"
"35f0482b4eadd92d5cd00932a729f00c64ce9e76",1,"Neural joint attention code search over structure embeddings for software Q&A sites","NJDACS is a novel two-way attention-based neural network for retrieving code fragments in software Q&A sites, which aligns and focuses the more structure informative parts of source codes to natural query.","Journal of Systems and Software",2020,"Gang Hu,Min Peng,Yihan Zhang,Qianqian Xie,Mengting Yuan",5,84,0,"https://www.semanticscholar.org/paper/35f0482b4eadd92d5cd00932a729f00c64ce9e76"
"b28ca9fb2056c8fd3f37e066f7809e7af27ef9b0",1,"BF++: a language for general-purpose neural program synthesis","A new programming language, BF++, is proposed, designed specifically for neural program synthesis in a Partially Observable Markov Decision Process (POMDP) setting and generate programs for a number of standard OpenAI Gym benchmarks.","ArXiv",2021,"Vadim Liventsev,Aki Härmä,M. Petkovic",2,47,0,"https://www.semanticscholar.org/paper/b28ca9fb2056c8fd3f37e066f7809e7af27ef9b0"
"ed2a639dd4a6b3abdcc0040733a264cb1dbcd7d4",1,"PlotCoder: Hierarchical Decoding for Synthesizing Visualization Code in Programmatic Context","This paper introduces PlotCoder, a new hierarchical encoder-decoder architecture that models both the code context and the input utterance and uses it to first determine the template of the visualization code, followed by predicting the data to be plotted.","Annual Meeting of the Association for Computational Linguistics",2021,"Xinyun Chen,Linyuan Gong,Alvin Cheung,D. Song",10,42,5,"https://www.semanticscholar.org/paper/ed2a639dd4a6b3abdcc0040733a264cb1dbcd7d4"
"e13d317fe0178a8b8b67f4af995e7fac12c35014",1,"Analysis of Tree-Structured Architectures for Code Generation","This work presents an empirical analysis of the significance of input parse trees for code generation, and finds that structure-aware encodings are better at modelling inputs with multiple variables and capturing long-range dependencies for codegeneration.","Findings",2021,"Samip Dahal,A. Maharana,Mohit Bansal",3,35,1,"https://www.semanticscholar.org/paper/e13d317fe0178a8b8b67f4af995e7fac12c35014"
"8e5b4aad131263457a38adbbffebe1b252802f1e",1,"Text2PyCode: Machine Translation of Natural Language Intent to Python Source Code","","International Cross-Domain Conference on Machine Learning and Knowledge Extraction",2021,"Sridevi Bonthu,S. R. Sree,M. K. Prasad",3,2,1,"https://www.semanticscholar.org/paper/8e5b4aad131263457a38adbbffebe1b252802f1e"
"62aceee1eca236841fddbad25833802750a92656",1,"Institutional Knowledge at Singapore Management University Institutional Knowledge at Singapore Management University CC2Vec: Distributed representations of code changes CC2Vec: Distributed representations of code changes","This work proposed CC2Vec, a neural network model that learns a representation of code changes guided by their accompanying log messages, which represent the semantic intent of the code changes, which outperform the state-of-the-art techniques.","",2021,"Thong Hoang",0,63,0,"https://www.semanticscholar.org/paper/62aceee1eca236841fddbad25833802750a92656"
"4d8bfc6b35d46a5a1dbad7aa273e81f49f5f6e4b",1,"Deep Learning Based Code Generation from Requirements Text: Are We There Yet?","A popularity based approach is proposed that always generates the most popular statements in training programs regardless of the input (software requirements), and evaluation results suggest that none of the state-of-the-art approaches can outperform this simple statistics-based approach.","",2021,"Hui Liu,Mingzhu Shen,Jiaqi Zhu,Nan Niu,Ge Li,Lu Zhang",0,60,0,"https://www.semanticscholar.org/paper/4d8bfc6b35d46a5a1dbad7aa273e81f49f5f6e4b"
"b029346bfa85fa2fc7a12498ae5f018922ce55f9",1,"Code Generation from Natural Language with Less Prior Knowledge and More Monolingual Data","This work investigates whether a generic transformer-based seq2seq model can achieve competitive performance with minimal code-generation-specific inductive bias design and achieves 81.03% exact match accuracy on Django and 32.57 BLEU score on CoNaLa.","Annual Meeting of the Association for Computational Linguistics",2021,"Sajad Norouzi,Keyi Tang,Yanshuai Cao",7,35,1,"https://www.semanticscholar.org/paper/b029346bfa85fa2fc7a12498ae5f018922ce55f9"
"ceeac1741f8c8dee5a1365828f79e8d3e84b0623",1,"Semantic Parsing with Less Prior and More Monolingual Data","This work investigates whether a generic transformerbased seq2seq model can achieve competitive performance with minimal semantic-parsing specific inductive bias design, and achieves positive evidence of a potentially easier path toward building accurate semantic parsers in the wild.","ArXiv",2021,"Sajad Norouzi,Yanshuai Cao",0,43,0,"https://www.semanticscholar.org/paper/ceeac1741f8c8dee5a1365828f79e8d3e84b0623"
"010c9f63c51ccc504de36d2d1693e0ea9d525da1",1,"Deep Learning for Source Code Modeling and Generation","A comprehensive review to categorize and investigate existing DL methods for source code modeling and generation, and formulate common program learning tasks under an encoder-decoder framework to address the limitations of the traditional source code models.","ACM Computing Surveys",2020,"T. H. Le,Hao Chen,M. Babar",57,297,1,"https://www.semanticscholar.org/paper/010c9f63c51ccc504de36d2d1693e0ea9d525da1"
"8c779ca55bef46f2380c1aea163ce9415f47b335",1,"One size does not fit all: Constructing complementary digital reskilling strategies using online labour market data","This commentary argues that, over the last decade, online labour platforms have become the ‘laboratories’ of skill rebundling; the combination of skills from different occupational domains that allows a new taxonomy on the individual complementarity of skills to be established.","",2021,"F. Stephany",9,37,1,"https://www.semanticscholar.org/paper/8c779ca55bef46f2380c1aea163ce9415f47b335"
"216425e1407875c94a754389b20bf983afe242c5",1,"Teach me how to Label: Labeling Functions from Natural Language with Text-to-text Transformers","The task of turning natural language descriptions into Python labeling functions by following a novel approach to semantic parsing with pre-trained text-to-text Transformers achieves a new state of the art on the semantic parsing benchmark CoNaLa, surpassing the previous best approach by 3.7 BLEU points.","ArXiv",2021,"Yannis Papanikolaou",0,23,0,"https://www.semanticscholar.org/paper/216425e1407875c94a754389b20bf983afe242c5"
