"id","score","title","summary","venue","year","authors","citationCount","referenceCount","influentialCitationCount","url"
"b2c4fdb49bdb23e6ad0ac3272029324157046ea7",7,"Automated Repair of Code from Language Models","The study revealed that automatically generated code shares common programming mistakes with human-crafted solutions, indicating APR techniques may have potential to auto-generated code, and given bug location information provided by a statistical fault localization approach, Codex edit mode is similar to or better than existing Java repair tools TBar and Recoder in correcting incorrect solutions.","",2022,"Zhiyu Fan,Xiang Gao,M. Mirchev,Abhik Roychoudhury,Shin Hwei Tan",0,49,0,"https://www.semanticscholar.org/paper/b2c4fdb49bdb23e6ad0ac3272029324157046ea7"
"0bcd59da541fdae66884afba8d25475a54a9da1a",7,"Automated Repair of Programs from Large Language Models","The study revealed that automatically generated code shares common programming mistakes with human-crafted solutions, indicating APR techniques may have potential to auto-generated code, and given bug location information provided by a statistical fault localization approach, Codex edit mode is similar to or better than existing Java repair tools TBar and Recoder in correcting incorrect solutions.","",2022,"Zhiyu Fan,Xiang Gao,M. Mirchev,Abhik Roychoudhury,Shin Hwei Tan",1,49,0,"https://www.semanticscholar.org/paper/0bcd59da541fdae66884afba8d25475a54a9da1a"
"e73a16490c29530c37b49f6a30592790e7caaaa4",6,"Don't Complete It! Preventing Unhelpful Code Completion for Productive and Sustainable Neural Code Completion Systems","An early-rejection mechanism to turn down low-return prompts by foretelling the code completion qualities without sending them to the codepletion system is proposed and a lightweight Transformer-based estimator is proposed to demonstrate the feasibility of the mechanism.","",2022,"Zhensu Sun,Xiaoning Du,Fu Song,Shangwen Wang,Mingze Ni,Li Li",0,33,0,"https://www.semanticscholar.org/paper/e73a16490c29530c37b49f6a30592790e7caaaa4"
"6074c7b75f27ca9adb6d74b080c07d5d079c3ea0",6,"Improving automatically generated code from Codex via Automated Program Repair","This study systematically study whether automated program repair (APR) techniques can fix the incorrect solutions produced by language models in LeetCode contests, revealing that automatically generated codes share some common programming mistakes with human-crafted solutions, indicating existing APR tools have the potential to fix auto-generated code.","ArXiv",2022,"Zhiyu Fan,Xiang Gao,Abhik Roychoudhury,Shin Hwei Tan",4,45,0,"https://www.semanticscholar.org/paper/6074c7b75f27ca9adb6d74b080c07d5d079c3ea0"
"1b4c19168410fb2690d285b205ab2281793db81a",6,"A Scalable and Extensible Approach to Benchmarking NL2Code for 18 Programming Languages","It is shown that on several languages, Codex matches and even exceeds its performance on Python, and a general approach is described for easily adding support for new benchmarks and languages to MultiPL-E, the first multi-language parallel benchmark for natural-language-to-code-generation.","ArXiv",2022,"Federico Cassano,John Gouwar,Daniel Nguyen,S. Nguyen,Luna Phipps-Costin,Donald Pinckney,Ming-Ho Yee,Yangtian Zi,Carolyn Jane Anderson,Molly Q. Feldman,Arjun Guha,M. Greenberg,Abhinav Jangda",4,27,1,"https://www.semanticscholar.org/paper/1b4c19168410fb2690d285b205ab2281793db81a"
"fba0b0817dbc8200b41a1de22654b54b778a11e9",6,"Recommending Root-Cause and Mitigation Steps for Cloud Incidents using Large Language Models","This work does the first large-scale study to evaluate the effectiveness of GPT-3.x models for helping engineers root cause and mitigate production incidents and compares several large language models in zero-shot, fine-tuned and multi-task setting using semantic and lexical metrics.","ArXiv",2023,"Toufique Ahmed,Supriyo Ghosh,Chetan Bansal,T. Zimmermann,Xuchao Zhang,S. Rajmohan",0,64,0,"https://www.semanticscholar.org/paper/fba0b0817dbc8200b41a1de22654b54b778a11e9"
"68edfd62d2619fb4af7c2469edb95b9e2fe4544a",6,"Execution-based Code Generation using Deep Reinforcement Learning","PPOCoder is a new framework for code generation that combines pretrained PL models with Proximal Policy Optimization (PPO) deep reinforcement learning and employs execution feedback as the external source of knowledge into the model optimization, which is transferable across different code generation tasks and PLs.","ArXiv",2023,"Parshin Shojaee,Aneesh Jain,S. Tipirneni,C. Reddy",0,45,0,"https://www.semanticscholar.org/paper/68edfd62d2619fb4af7c2469edb95b9e2fe4544a"
"3d5463a16d85d9d1d0d8ebb4117a31aca3c240ff",5,"Fooling MOSS Detection with Pretrained Language Models","It is found that a student using GPT-J can complete introductory level programming assignments without triggering suspicion from MOSS, a widely used software similarity and plagiarism detection tool.","International Conference on Information and Knowledge Management",2022,"Stella Rose Biderman,Edward Raff",2,70,0,"https://www.semanticscholar.org/paper/3d5463a16d85d9d1d0d8ebb4117a31aca3c240ff"
"6032212d5790b6a580d68d469a9895aad6238c89",5,"Diverse Title Generation for Stack Overflow Posts with Multiple Sampling Enhanced Transformer","A novel approach to automatically generate multiple post titles from the given code snippets, using the maximal marginal multiple nucleus sampling strategy to generate multiple high-quality and diverse title candidates at a time for the developers to choose from.","ArXiv",2022,"Fengji Zhang,Jin Liu,Yao Wan,Xiao Yu,Xiao Liu,J. Keung",0,56,0,"https://www.semanticscholar.org/paper/6032212d5790b6a580d68d469a9895aad6238c89"
"ebd4bec684808aff360b5f255d15c0d112ba13d3",5,"Explicit Knowledge Transfer for Weakly-Supervised Code Generation","This paper proposes explicit knowledge transfer (EKT), which uses the few-shot capabilities of a teacher LLM to create NL-code pairs that are filter for correctness and fine-tune the student on, and finds that EKT not only yields better performance than training with expert iteration, but also outperforms knowledge distillation, another form of knowledge transfer.","ArXiv",2022,"Zhangir Azerbayev,Ansong Ni,Hailey Schoelkopf,Dragomir R. Radev",0,29,0,"https://www.semanticscholar.org/paper/ebd4bec684808aff360b5f255d15c0d112ba13d3"
"d3a7a4543d83f568f79d1febe8379465ff0140c9",5,"A Survey of Deep Learning for Mathematical Reasoning","This survey paper reviews the key tasks, datasets, and methods at the intersec-tion of mathematical reasoning and deep learning over the past decade, and evaluates existing benchmarks and methods and discusses future research directions.","ArXiv",2022,"Pan Lu,Liang Qiu,Wenhao Yu,S. Welleck,Kai-Wei Chang",1,216,1,"https://www.semanticscholar.org/paper/d3a7a4543d83f568f79d1febe8379465ff0140c9"
"d8405996b4d08c304098636aedd9e1c1a1e262ee",5,"The Premature Obituary of Programming","Why deep learning will not replace programming and why deep learning should not be considered as a programming language.","Communications of the ACM",2023,"D. Yellin",0,23,0,"https://www.semanticscholar.org/paper/d8405996b4d08c304098636aedd9e1c1a1e262ee"
"1c8e15f15d67c5974445634bb971e2275e957aff",4,"Security Implications of Large Language Model Code Assistants: A User Study","A security-driven user study to assess code written by student programmers when assisted by LLMs and indicates that the security impact in this setting is small: AI-assisted users produce critical security bugs at a rate no greater than 10% more than the control.","ArXiv",2022,"Gustavo Sandoval,H. Pearce,Teo Nys,R. Karri,Brendan Dolan-Gavitt,S. Garg",4,53,0,"https://www.semanticscholar.org/paper/1c8e15f15d67c5974445634bb971e2275e957aff"
"a7435722d8ab595da5a9c70ac9160f57d0dcd75a",4,"Enabling Transformers to Understand Low-Level Programs","This work applies transfer learning to low-level (LLVM) programs and study how low- level programs can be made more amenable to Transformer models through various techniques, including preprocessing, infix/prefix operators, and information deduplication.","IEEE Conference on High Performance Extreme Computing",2022,"Zifan Carl Guo,William S. Moses",0,53,0,"https://www.semanticscholar.org/paper/a7435722d8ab595da5a9c70ac9160f57d0dcd75a"
"971e875e28f26240987d2c9470d1ee74ad204205",4,"Large Language Models are Few-shot Testers: Exploring LLM-based General Bug Reproduction","Results show L IBRO has the potential to enhance developerency by automatically generating tests from bug reports, and is proposed as a framework that uses Large Language Models (LLMs), which have been shown to be capable of performing code-related tasks.","ArXiv",2022,"Sungmin Kang,Juyeon Yoon,Shin Yoo",0,39,0,"https://www.semanticscholar.org/paper/971e875e28f26240987d2c9470d1ee74ad204205"
"825333b7efe2cade106eaf36c7e731f757974806",4,"How Readable is Model-generated Code? Examining Readability and Visual Inspection of GitHub Copilot","The results suggest that model generated code is comparable in complexity and readability to code written by human pair programmers, and eye tracking data suggests, to a statistically significant level, that programmers direct less visual attention to model generate code.","37th IEEE/ACM International Conference on Automated Software Engineering",2022,"Naser Al Madi",0,28,0,"https://www.semanticscholar.org/paper/825333b7efe2cade106eaf36c7e731f757974806"
"39e40821b7207125e54e6ed7112e55cd38c6f0c3",4,"Language Models of Code are Few-Shot Commonsense Learners","This paper shows that when this task is frame as code generation tasks, pre-trained LMs of code are better structured commonsense reasoners than L Ms of natural language, even when the downstream task does not involve source code at all.","Conference on Empirical Methods in Natural Language Processing",2022,"Aman Madaan,Shuyan Zhou,Uri Alon,Yiming Yang,Graham Neubig",11,38,1,"https://www.semanticscholar.org/paper/39e40821b7207125e54e6ed7112e55cd38c6f0c3"
"a6ef5bad716091fb1888bf365f6129628ab3a5ee",4,"ObSynth: An Interactive Synthesis System for Generating Object Models from Natural Language Specifications","ObSynth is introduced, an interactive system leveraging the domain knowledge em-bedded in large language models (LLMs) to help users design object models from high level natural language prompts, showing that it often synthesizes objects, methods, and methods users might have otherwise omitted.","ArXiv",2022,"Alex Gu,Tamara Mitrovska,D. Vélez,Jacob Andreas,Armando Solar-Lezama",0,29,0,"https://www.semanticscholar.org/paper/a6ef5bad716091fb1888bf365f6129628ab3a5ee"
"0566c1c3eeeef5c968fced6d80b77fe22d02bbd9",4,"Conversing with Copilot: Exploring Prompt Engineering for Solving CS1 Problems Using Natural Language","Evaluating the performance of Copilot on a publicly available dataset of 166 programming problems finds that it successfully solves around half of these problems on its very first attempt, and that it solves 60% of the remaining problems using only natural language changes to the problem description.","ArXiv",2022,"Paul Denny,Viraj Kumar,Nasser Giacaman",5,24,0,"https://www.semanticscholar.org/paper/0566c1c3eeeef5c968fced6d80b77fe22d02bbd9"
"ec7324a15009a9bd0b676f6b17762f759cf5dd9a",4,"Large Language Models Are Human-Level Prompt Engineers","It is shown that APE-engineered prompts can be applied to steer models toward truthfulness and/or informativeness, as well as to improve few-shot learning performance by simply prepending them to standard in-context learning prompts.","ArXiv",2022,"Yongchao Zhou,Andrei Ioan Muresanu,Ziwen Han,Keiran Paster,Silviu Pitis,Harris Chan,Jimmy Ba",12,51,2,"https://www.semanticscholar.org/paper/ec7324a15009a9bd0b676f6b17762f759cf5dd9a"
"71280dba5bda65c162f9deaffed7d3d20692ca0a",4,"SecurityEval dataset: mining vulnerability examples to evaluate machine learning-based code generation techniques","SecurityEval, an evaluation dataset that contains 130 samples for 75 vulnerability types, which are mapped to the Common Weakness Enumeration (CWE) and demonstrated using one open-source and one closed-source code generation model to evaluate.","",2022,"Mohammed Latif Siddiq,msiddiq",3,28,1,"https://www.semanticscholar.org/paper/71280dba5bda65c162f9deaffed7d3d20692ca0a"
"c192fb33f308f19ac8a5c4c2d623d56385b839be",4,"Systematic Literature Review on Solving Competitive Programming Problem with Artificial Intelligence (AI)","It can be concluded that the code auto-completion and code-generation tools that are available now still do not meet the necessary benchmark which is solving CP tasks, and AI still has a long way to go before competing at the highest level of CP.","2022 1st International Conference on Software Engineering and Information Technology (ICoSEIT)",2022,"Francis Alexander,Edwin Ario Abdiwijaya,Felix Pherry,A. A. Gunawan,Anderies",0,30,0,"https://www.semanticscholar.org/paper/c192fb33f308f19ac8a5c4c2d623d56385b839be"
"8175ce2cbb99b6a394bdac152ae39d413f4f1380",4,"Codex Hacks HackerRank: Memorization Issues and a Framework for Code Synthesis Evaluation","This work evaluates the code synthesis capabilities of the Codex model based on a set of 115 Python problem statements from a popular competitive programming portal: HackerRank, and proposes a framework for code-synthesis evaluation using variations of problem statements based on mutations.","ArXiv",2022,"Anjan Karmakar,Julian Aron Prenner,Marco D'Ambros,R. Robbes",1,37,0,"https://www.semanticscholar.org/paper/8175ce2cbb99b6a394bdac152ae39d413f4f1380"
"9e8f0d9ba4e7af673c8b214b3764e020706dd1f3",4,"Don't Generate, Discriminate: A Proposal for Grounding Language Models to Real-World Environments","Pangu is proposed, a generic framework for grounded language understanding that capitalizes on the discriminative ability of LMs instead of their generative ability, and enables, for the first time, effective few-shot in-context learning for KBQA with large LMs such as Codex.","ArXiv",2022,"Yu Gu,Xiang Deng,Yu Su",0,66,0,"https://www.semanticscholar.org/paper/9e8f0d9ba4e7af673c8b214b3764e020706dd1f3"
"12a4e62c43b829dabdb8afc60eee76aa80fa3f6e",4,"Fuzzing Deep-Learning Libraries via Large Language Models","LLMFuzz is the first automated approach to directly leveraging Large Pre-trained Language Models (LLMs) to generate input programs for fuzzing DL libraries, and is able to detect 65 bugs, with 41 already confirmed as previously unknown bugs.","ArXiv",2022,"Yinlin Deng,Chun Xia,Haoran Peng,Chenyuan Yang,Lingming Zhang",0,65,0,"https://www.semanticscholar.org/paper/12a4e62c43b829dabdb8afc60eee76aa80fa3f6e"
"c72ac81c4ac414314b52cf8f5b77370f8d0875d4",4,"Generating High-Precision Feedback for Programming Syntax Errors using Large Language Models","The key idea behind PyFiXV is to use a novel run-time validation mechanism to decide whether the generated feedback is suitable for sharing with the student; notably, this validation mechanism also provides a precision knob to educators.","ArXiv",2023,"Tung Phung,J. Cambronero,Sumit Gulwani,Tobias Kohn,R. Majumdar,A. Singla,Gustavo Soares",0,36,0,"https://www.semanticscholar.org/paper/c72ac81c4ac414314b52cf8f5b77370f8d0875d4"
"0885556b71b24a641b4ffe139afd4d2712228cff",4,"Beware of the Unexpected: Bimodal Taint Analysis","Fluffy is presented, a bimodal taint analysis that combines static analysis, which reasons about data flow, with machine learning, which probabilistically determines which flows are potentially problematic.","ArXiv",2023,"Yiu Wai Chow,Max Schäfer,Michael Pradel",0,54,0,"https://www.semanticscholar.org/paper/0885556b71b24a641b4ffe139afd4d2712228cff"
"e9a64e58855dbbc725203d0202ceb9e7f8b7bb36",3,"A Survey of Learning-based Automated Program Repair","This work presents a meta-modelling system that automates the very labor-intensive and therefore time-heavy and therefore expensive and expensive process of manually cataloging and cataloging individual neurons in the brain.","ArXiv",2023,"Quanjun Zhang,Chunrong Fang,Yuxiang Ma,Weisong Sun,Zhenyu Chen",1,185,0,"https://www.semanticscholar.org/paper/e9a64e58855dbbc725203d0202ceb9e7f8b7bb36"
"b1eebb2df3b9ff7ff2b00fb1a786f6ada2caebce",3,"Towards a Mathematics Formalisation Assistant using Large Language Models","The abilities of a large language model (Codex) to help with formalisation in the Lean theorem prover are explored, finding that with careful inputdependent prompt selection and postprocessing, Codex is able to formalise short mathematical statements at undergrad level with nearly 75% accuracy for 120 theorem statements.","ArXiv",2022,"Ayush Agrawal,Siddhartha Gadgil,Navin Goyal,Ashvni Narayanan,Anand Tadipatri",0,26,0,"https://www.semanticscholar.org/paper/b1eebb2df3b9ff7ff2b00fb1a786f6ada2caebce"
"4ddc26b3a5fe9044b97b408d163f7464d769ebbf",3,"CODEP: Grammatical Seq2Seq Model for General-Purpose Code Generation","This paper proposes CODEP, a grammatical Seq2Seq code generation framework equipped with a Pushdown automaton (PDA) module, and constructs the DPA for the most popular GPL Python and conducts extensive experiments to evaluate the effectiveness.","ArXiv",2022,"Yihong Dong,Ge Li,Zhi Jin",2,41,0,"https://www.semanticscholar.org/paper/4ddc26b3a5fe9044b97b408d163f7464d769ebbf"
"7497360b0f411a44aa6afbd8b830050c40ec8aed",3,"Dataset of Student Solutions to Algorithm and Data Structure Programming Assignments","This paper presents a dataset containing source code solutions to algorithmic programming exercises solved by hundreds of Bachelor-level students at the University of Hamburg, and plans to extend the dataset with tasks and solutions from upcoming courses.","International Conference on Language Resources and Evaluation",2022,"Fynn Petersen-Frey,Marcus Soll,Louis Kobras,Melf Johannsen,Peter Kling,Chris Biemann",0,18,0,"https://www.semanticscholar.org/paper/7497360b0f411a44aa6afbd8b830050c40ec8aed"
"4f278ab5ad629267e06196e273252262854c1c57",3,"BF++: a language for general-purpose program synthesis","A new programming language, BF ++ is proposed, designed speciﬁcally for automatic programming of agents in a Partially Observable Markov Decision Process (POMDP) setting and apply neural program synthesis to solve standard OpenAI Gym benchmarks.","",2021,"Vadim Liventsev,A. Harma,M. Petkovi'c",0,57,0,"https://www.semanticscholar.org/paper/4f278ab5ad629267e06196e273252262854c1c57"
"92173d081b15824d22a9ef070e118744ceee8052",3,"Show Your Work: Scratchpads for Intermediate Computation with Language Models","Surprisingly, large pre-trained language models are able to perform complex multistep computations—even in the few-shot regime—when asked to perform the operation “step by step”, showing the results of intermediate computations.","ArXiv",2021,"Maxwell Nye,Anders Andreassen,Guy Gur-Ari,H. Michalewski,Jacob Austin,David Bieber,David Dohan,Aitor Lewkowycz,Maarten Bosma,D. Luan,Charles Sutton,Augustus Odena",112,30,11,"https://www.semanticscholar.org/paper/92173d081b15824d22a9ef070e118744ceee8052"
"a5731122200fbb8b37f048010a1e1ca4474aa606",3,"Examining Zero-Shot Vulnerability Repair with Large Language Models","This work examines the use of large language models for code (such as OpenAI’s Codex and AI21's Jurassic J-1) for zero-shot vulnerability repair, and investigates challenges in the design of prompts that coax LLMs into generating repaired versions of insecure code.","",2021,"H. Pearce,B. Tan,Baleegh Ahmad,R. Karri,Brendan Dolan-Gavitt",7,56,0,"https://www.semanticscholar.org/paper/a5731122200fbb8b37f048010a1e1ca4474aa606"
"5ff9032d0f7f246d01ae7b2c231ab03469a7344a",3,"Can OpenAI Codex and Other Large Language Models Help Us Fix Security Bugs?","This work examines the use of large language models for code (such as OpenAI's Codex and AI21's Jurassic J-1) for zero-shot vulnerability repair, and investigates challenges in the design of prompts that coax LLMs into generating repaired versions of insecure code.","ArXiv",2021,"H. Pearce,B. Tan,Baleegh Ahmad,R. Karri,Brendan Dolan-Gavitt",20,56,1,"https://www.semanticscholar.org/paper/5ff9032d0f7f246d01ae7b2c231ab03469a7344a"
"9a2ca811882ed7513f83014b9de4fb3b4ab218c4",3,"C OMPOSITIONAL G ENERALIZATION AND D ECOMPOSITION IN N EURAL P ROGRAM S YNTHESIS","A suite of generalization tasks, which measure different types of compositional generalization that are desirable for program synthesis and are particularly difﬁcult for current sequence to sequence models, are proposed.","",,"",0,0,0,"https://www.semanticscholar.org/paper/9a2ca811882ed7513f83014b9de4fb3b4ab218c4"
"a2b6e1f7d8a7963d321f29fca7c01eeb1ebd7f0f",3,"P ATCH G ENERATION WITH L ANGUAGE M ODELS : F EASIBILITY AND S CALING B EHAVIOR","This work highlights a noticeable correlation of model size with test-passing accuracy and patch ranking quality, and the propensity for especially the largest models to generate candidate patches that closely resemble (if not exactly match), the original developer patch.","",2022,"Sophia Kolak,Ruben Martins,Claire Le Goues,V. Hellendoorn",0,23,0,"https://www.semanticscholar.org/paper/a2b6e1f7d8a7963d321f29fca7c01eeb1ebd7f0f"
"78863000eb70945cc8d791d45d4a3fe8a6521cb6",3,"Open-ended Knowledge Tracing for Computer Science Education","An initial solution to the OKT problem is developed, a student knowledge-guided code generation approach that combines program synthesis methods using language models with student knowledge tracing methods and a series of quantitative and qualitative experiments on a real-world student code dataset to validate and demonstrate the promise of OKT.","Conference on Empirical Methods in Natural Language Processing",2022,"Naiming Liu,Zichao Wang",0,55,0,"https://www.semanticscholar.org/paper/78863000eb70945cc8d791d45d4a3fe8a6521cb6"
"56e6d62c638a24411f12d15cdc8821a31fc495c8",3,"Source Code Generation from Descriptions in a Natural Language","This work introduces CodeFormer, a Python source code generator pretrained on a massive GitHub crawl consisting of 230M Python functions, and releases the resulting model, built on BART architecture, which generates Python functions based on descriptions in English.","",2022,"Bc. Jan Pašek",0,70,0,"https://www.semanticscholar.org/paper/56e6d62c638a24411f12d15cdc8821a31fc495c8"
"1aed58bd07026492194672adec494dc37c894a28",3,"Leveraging Automated Unit Tests for Unsupervised Code Translation","This work proposes to leverage an automated unit-testing system to filter out invalid translations, thereby creating a fully tested parallel corpus, and finds that fine-tuning an unsupervised model with this filtered data set significantly reduces the noise in the translations so-generated, comfortably outperforming the state of the art for all language pairs studied.","International Conference on Learning Representations",2021,"Baptiste Rozière,J Zhang,François Charton,M. Harman,Gabriel Synnaeve,Guillaume Lample",19,60,2,"https://www.semanticscholar.org/paper/1aed58bd07026492194672adec494dc37c894a28"
"52db8674337e5d86dcb96d013734befc8c3d4581",3,"Large Language Models are not Models of Natural Language: they are Corpus Models.","It is argued that the term language model is misleading because deep learning models are not theoretical models of language and proposed the adoption of corpus model instead, which better reflects the genesis and contents of the model.","IEEE Access",2021,"C. Veres",1,63,0,"https://www.semanticscholar.org/paper/52db8674337e5d86dcb96d013734befc8c3d4581"
"7b5aa186ca8abc585607c5ec91562e127a398601",3,"Open-Ended Knowledge Tracing","This paper develops an initial solution to the OKT problem, a student knowledge-guided code generation approach that combines program synthesis methods using language models with student knowledge tracing methods and conducts a series of quantitative and qualitative experiments on a real-world student code dataset to validate OKT and demonstrate its promise in educational applications.","ArXiv",2022,"Naiming Liu,Zichao Wang,Richard Baraniuk,Andrew S. Lan",0,64,0,"https://www.semanticscholar.org/paper/7b5aa186ca8abc585607c5ec91562e127a398601"
"1f11601f9eb8c0bee1d1d2cc7f4fa187e8c5e525",3,"The impact of lexical and grammatical processing on generating code from natural language","The paper highlights the importance of the lexical substitution component in the current natural language to code systems with a state-of-the-art architecture that relies on BERT encoder and a grammar-based decoder for which a formalization is provided.","Findings",2022,"Nathanael Beau,Benoit Crabb'e",4,19,2,"https://www.semanticscholar.org/paper/1f11601f9eb8c0bee1d1d2cc7f4fa187e8c5e525"
"771371fb288da26a9812f5808535847a0a9c9a80",3,"A Conversational Paradigm for Program Synthesis","This work proposes and trains C ODE G EN, an interactive code generation model for program synthesis, and suggests that the capacity of conversational program synthesis scales as a function of the model size and data size.","ArXiv",2022,"Erik Nijkamp,Bo Pang,Hiroaki Hayashi,Lifu Tu,Haiquan Wang,Yingbo Zhou,S. Savarese,Caiming Xiong",59,39,22,"https://www.semanticscholar.org/paper/771371fb288da26a9812f5808535847a0a9c9a80"
