"id","score","title","summary","venue","year","authors","citationCount","referenceCount","influentialCitationCount","url"
"4054fc9e8776dc0324cfc215462d606eb75916c0",2,"Expectation vs. Experience: Evaluating the Usability of Code Generation Tools Powered by Large Language Models","It was found that, while Copilot did not necessarily improve the task completion time or success rate, most participants preferred to use Copilot in daily programming tasks, since Copilot often provided a useful starting point and saved the effort of searching online.","CHI Extended Abstracts",2022,"Ganesha Upadhyaya,Anastasia Reinhardt,Hridesh Rajan,Miryung Kim,Elena L. Glassman,B. Hartmann,Joseph Pinedo",34,53,5,"https://www.semanticscholar.org/paper/4054fc9e8776dc0324cfc215462d606eb75916c0"
"4bc040835fbff57ce6612306d794b8c6c8226086",2,"Discovering the Syntax and Strategies of Natural Language Programming with Generative Language Models","A natural language code synthesis tool, GenLine, backed by a large generative language model and a set of task-specific prompts that create or change code is presented, indicating that while naturallanguage code synthesis can sometimes provide a magical experience, participants still faced challenges.","International Conference on Human Factors in Computing Systems",2022,"Ellen Jiang,Edwin Toh,A. Molina,Kristen Olson,Claire Kayacik,Aaron Donsbach,Carrie J. Cai,Michael Terry",11,36,2,"https://www.semanticscholar.org/paper/4bc040835fbff57ce6612306d794b8c6c8226086"
"f8aa0cab09bc0668276e2cb5690bae47fa50d350",2,"An Initial Look at Self-Reprogramming Artificial Intelligence","This paper develops and experimentally validate the first fully self-reprogramming AI system with the ability to continuously modify and rewrite its own neural network source code.","ArXiv",2022,"Alex Sheng",0,14,0,"https://www.semanticscholar.org/paper/f8aa0cab09bc0668276e2cb5690bae47fa50d350"
"1f3a97d255a6d0b2d5535af75737ed43b1e96fc4",2,"Is GitHub Copilot a Substitute for Human Pair-programming? An Empirical Study","The results suggest that although Copilot increases productivity as measured by Lines of code added, the quality of code produced is inferior by having more lines of code deleted in the subsequent trial.","2022 IEEE/ACM 44th International Conference on Software Engineering: Companion Proceedings (ICSE-Companion)",2022,"Saki Imai",9,11,0,"https://www.semanticscholar.org/paper/1f3a97d255a6d0b2d5535af75737ed43b1e96fc4"
"cdfe9580f63070f311151444f9df32818cc858bf",2,"An Empirical Evaluation of GitHub Copilot's Code Suggestions","Overall, Copilot's suggestions have low complexity with no notable differences between the programming languages and some potential Copilot shortcomings are found.","IEEE Working Conference on Mining Software Repositories",2022,"N. Nguyen,Sarah Nadi",18,29,3,"https://www.semanticscholar.org/paper/cdfe9580f63070f311151444f9df32818cc858bf"
"5922f437512158970c417f4413bface021df5f78",2,"A Generalist Agent","","ArXiv",2022,"S. Reed,Konrad Zolna,Emilio Parisotto,Sergio Gomez Colmenarejo,Alexander Novikov,Gabriel Barth-Maron,Mai Gimenez,Yury Sulsky,Jackie Kay,J. T. Springenberg,Tom Eccles,Jake Bruce,Ali Razavi,Ashley D. Edwards,N. Heess,Yutian Chen,R. Hadsell,Oriol Vinyals,Mahyar Bordbar,N. D. Freitas",131,102,19,"https://www.semanticscholar.org/paper/5922f437512158970c417f4413bface021df5f78"
"c61ce808818308566124df2c8725c98d6bd38dc3",2,"A Precis of Language Models are not Models of Language","It is shown that despite their many successes at performing linguistic tasks, Large Neural Language Models are ill suited as comprehensive models of natural language.","ArXiv",2022,"C. Veres",0,16,0,"https://www.semanticscholar.org/paper/c61ce808818308566124df2c8725c98d6bd38dc3"
"58aacb967cc7fc25cfc9d51b7ad3e57ac00d119b",2,"Can Foundation Models Wrangle Your Data?","It is found that large FMs generalize and achieve SoTA performance on data cleaning and integration tasks, even though they are not trained for these data tasks.","Proceedings of the VLDB Endowment",2022,"A. Narayan,Ines Chami,Laurel J. Orr,Christopher R'e",6,91,1,"https://www.semanticscholar.org/paper/58aacb967cc7fc25cfc9d51b7ad3e57ac00d119b"
"adce1da47d490dcdca254ccd43055ed4f4423bc2",2,"Summarize and Generate to Back-translate: Unsupervised Translation of Programming Languages","It is shown that the proposed framework performsably to state-of-the-art methods, if not exceed their translation performance between Java 032 and Python languages.","ArXiv",2022,"Wasi Uddin Ahmad,Saikat Chakraborty,Baishakhi Ray,Kai-Wei Chang",1,49,0,"https://www.semanticscholar.org/paper/adce1da47d490dcdca254ccd43055ed4f4423bc2"
"f1b6b34b4440a77ba86493f7062e8974062508c5",2,"Applying genetic programming to PSB2: the next generation program synthesis benchmark suite","25 new general program synthesis benchmark problems that make up PSB2, a new benchmark suite curated from a variety of sources, including programming katas and college courses are described.","Genetic Programming and Evolvable Machines",2022,"Thomas Helmuth,Peter Kelly",1,62,0,"https://www.semanticscholar.org/paper/f1b6b34b4440a77ba86493f7062e8974062508c5"
"8c7fd98b6bc4f32772e76471afe8babc323f10d3",2,"CitySpec: An Intelligent Assistant System for Requirement Specification in Smart Cities","This work builds CitySpec, the first intelligent assistant system for requirement specification in smart cities, and builds a translation model and enhance it through requirement synthesis and develops a novel online learning framework with validation under uncertainty.","International Conference on Smart Computing",2022,"Zirong Chen,Isaac Li,Haoxiang Zhang,S. Preum,J. Stankovic,Meiyi Ma",2,18,0,"https://www.semanticscholar.org/paper/8c7fd98b6bc4f32772e76471afe8babc323f10d3"
"40edfa97cd02268fccff75eb9c693b11c1a968b2",2,"Formal Specifications from Natural Language","These experiments show that language models maintain their generalization capabilities from pre-trained knowledge of natural language to generalize, e.g., to new variable names or operator descriptions, and achieve competitive performance, and even outperform the state-of-the-art for translating into regular expressions.","ArXiv",2022,"Christopher Hahn,Frederik Schmitt,Julia J. Tillman,Niklas Metzger,Julian Siber,B. Finkbeiner",1,97,0,"https://www.semanticscholar.org/paper/40edfa97cd02268fccff75eb9c693b11c1a968b2"
"a64871352f8ac7f8aa226fda5cce70251a18a4fc",2,"Assessing Project-Level Fine-Tuning of ML4SE Models","It is shown that per-project fine-tuning can greatly improve the models’ quality as they capture the project’s domain and naming conventions.","ArXiv",2022,"Egor Bogomolov,Sergey Zhuravlev,Egor Spirin,T. Bryksin",0,39,0,"https://www.semanticscholar.org/paper/a64871352f8ac7f8aa226fda5cce70251a18a4fc"
"9aed848be4e9e401b0e61a2e5d60dbdafa0c6cc1",2,"A Dataset and Benchmark for Automatically Answering and Generating Machine Learning Final Exams","A student survey comparing the quality, appropriateness, andulty of machine- generated questions with human-written questions shows that across multiple aspects, machine-generated questions are indistinguishable from human-generated Questions and are suitable for ﬁnal exams.","ArXiv",2022,"Sarah Zhang,Reece Shuttleworth,Derek Austin,Yann Hicke,Leonard Tang,Sathwik Karnik,Darnell Granberry,Iddo Drori",2,15,1,"https://www.semanticscholar.org/paper/9aed848be4e9e401b0e61a2e5d60dbdafa0c6cc1"
"52ca0f589fdcde1c45fd6dfb1b72248d4ecaefc0",2,"Code Translation with Compiler Representations","This paper proposes to augment code translation with IRs, speciﬁcally LLVM IR, with results on the C++, Java, Rust, and Go languages, and improves upon the state of the art for unsupervised code translation.","ArXiv",2022,"Marc Szafraniec,Baptiste Rozière,Hugh Leather Francois Charton,Patrick Labatut,Gabriel Synnaeve",2,43,0,"https://www.semanticscholar.org/paper/52ca0f589fdcde1c45fd6dfb1b72248d4ecaefc0"
"53661ff6fdbfb8557c5b19895fad151792c62da7",2,"Few-shot training LLMs for project-specific code-summarization","This paper investigates the use few-shot training with the very large GPT (Generative Pre-trained Transformer) Codex model, and finds evidence suggesting that one can significantly surpass state-of-the-art models for code-summarization, leveraging project-specific training.","International Conference on Automated Software Engineering",2022,"Toufique Ahmed,Prem Devanbu",2,25,0,"https://www.semanticscholar.org/paper/53661ff6fdbfb8557c5b19895fad151792c62da7"
"f843233f76a5dff07bfa93a71a1cf13d8aa6a94a",2,"Exploring Length Generalization in Large Language Models","It is shown that combining pretrained large language models’ in-context learning abilities with scratchpad prompting results in a dramatic improvement in length generalization, and is run to identify common sources of mistakes that highlight opportunities in equipping language models with the ability to generalize to longer problems.","ArXiv",2022,"Cem Anil,Yuhuai Wu,Anders Andreassen,Aitor Lewkowycz,Vedant Misra,V. Ramasesh,Ambrose Slone,Guy Gur-Ari,Ethan Dyer,Behnam Neyshabur",19,32,5,"https://www.semanticscholar.org/paper/f843233f76a5dff07bfa93a71a1cf13d8aa6a94a"
"e37155d21818513bd40d64ee212099aac82bd6f8",2,"Less training, more repairing please: revisiting automated program repair via zero-shot learning","This paper proposesAlphaRepair, the first cloze-style (or infilling-style) APR approach to directly leveraging large pre-trained code models for APR without any fine-tuning/retraining on historical bug fixes, and implements AlphaRepair as a practical multilingual APR tool based on the recent CodeBERT model.","ESEC/SIGSOFT FSE",2022,"Chun Xia,Lingming Zhang",6,77,1,"https://www.semanticscholar.org/paper/e37155d21818513bd40d64ee212099aac82bd6f8"
"2f2750b48a6f958ff12cba90e99695123d1e2f47",2,"Using pre-trained language models to resolve textual and semantic merge conflicts (experience paper)","The feasibility of automatically repairing merge conflicts using k-shot learning with pre-trained large neural language models (LM) such as GPT-3 is explored, and LMs provide the state-of-the-art (SOTA) performance on semantic merge conflict resolution for Edge compared to earlier symbolic approaches.","International Symposium on Software Testing and Analysis",2022,"Jialu Zhang,Todd Mytkowicz,Mike Kaufman,R. Piskac,Shuvendu K. Lahiri",2,29,0,"https://www.semanticscholar.org/paper/2f2750b48a6f958ff12cba90e99695123d1e2f47"
"1e3ec5709b2ca43233c566cd77dbabbd6892bfa6",2,"Neurosymbolic repair for low-code formula languages","LaMirage, a LAst-MIle RepAir-engine GEnerator that combines symbolic and neural techniques to perform last-mile repair in low-code formula languages, is developed and compared to state-of-the-art neural and symbolic approaches on 400 real Excel and Power Fx formulas, where LaMirage outperforms all baselines.","Proc. ACM Program. Lang.",2022,"Rohan Bavishi,Harshit Joshi,Jos'e Pablo Cambronero S'anchez,Anna Fariha,Sumit Gulwani,Vu Le,Ivan Radicek,A. Tiwari",2,69,0,"https://www.semanticscholar.org/paper/1e3ec5709b2ca43233c566cd77dbabbd6892bfa6"
"ec4c8d99eb1c028c43af6d8bbf727392d351cb59",2,"Efficient Training of Language Models to Fill in the Middle","There is extensive evidence that training models with a large fraction of data transformed in this way does not harm the original left-to-right generative capability, as measured by perplexity and sampling evaluations across a wide range of scales.","ArXiv",2022,"Mohammad Bavarian,Heewoo Jun,N. Tezak,J. Schulman,C. McLeavey,Jerry Tworek,Mark Chen",14,60,1,"https://www.semanticscholar.org/paper/ec4c8d99eb1c028c43af6d8bbf727392d351cb59"
"def2e28863338cb20782eb2015a39d32df697ed6",2,"Learning to Improve Code Efficiency","","ArXiv",2022,"Bing Chen,Daniel Tarlow,Kevin Swersky,M. Maas,P. Heiber,Ashish Naik,Milad Hashemi,P. Ranganathan",1,35,0,"https://www.semanticscholar.org/paper/def2e28863338cb20782eb2015a39d32df697ed6"
"8c2d9d2aa891e3b53bbd9166c1b804a0741fc44a",2,"Finding Reusable Machine Learning Components to Build Programming Language Processing Pipelines","To improve theability, accessibility, interoperability and reusability (FAIRness) of machine learning components, a set of representative papers in the domain of machineLearning-based PLP are collected and analyzed.","ArXiv",2022,"Patrick Flynn,T. Vanderbruggen,C. Liao,Pei-Hung Lin,M. Emani,Xipeng Shen",1,32,0,"https://www.semanticscholar.org/paper/8c2d9d2aa891e3b53bbd9166c1b804a0741fc44a"
"9b61de7038290751377b64293baaf42f3e7cf441",2,"An Empirical Evaluation of Competitive Programming AI: A Case Study of AlphaCode","An empirical study to find code similarities and performance differences between AlphaCode-generated codes and human codes shows that the generated codes are similar to human codes and the generated code performs on par with or worse than the human code in terms of execution time and memory usage.","International Workshop on Software Clones",2022,"Sila Lertbanjongngam,Bodin Chinthanet,T. Ishio,R. Kula,P. Leelaprute,Bundit Manaskasemsak,A. Rungsawang,Kenichi Matsumoto",1,35,0,"https://www.semanticscholar.org/paper/9b61de7038290751377b64293baaf42f3e7cf441"
"befde3e07ce97f02f12fe92ab27e99f23ccd17aa",2,"Evaluating Progress in Automatic Chest X-Ray Radiology Report Generation","This study quantitatively examines the correlation between automated metrics and the scoring of reports by radiologists, and proposes a composite metric, called RadCliQ, that is able to rank the quality of reports similarly to radiologists and better than existing metrics.","medRxiv",2022,"F. Yu,M. Endo,R. Krishnan,I. Pan,A. Tsai,E. P. Reis,E. Fonseca,H. M. H. Lee,Z. H. Abad,A. Y. Ng,C. Langlotz,V. Venugopal,P. Rajpurkar",1,33,0,"https://www.semanticscholar.org/paper/befde3e07ce97f02f12fe92ab27e99f23ccd17aa"
"6b5d1e50894b1f28e4798cf20e9ffa88b9ec011a",2,"How to Prompt? Opportunities and Challenges of Zero- and Few-Shot Learning for Human-AI Interaction in Creative Applications of Generative Models","This work discusses the key opportunities and challenges for interactive creative applications that use prompting as a new paradigm for Human-AI interaction and proposes four design goals for user interfaces that support prompting.","ArXiv",2022,"Hai Dang,Lukas Mecke,Florian Lehmann,Sven Goller,D. Buschek",2,22,0,"https://www.semanticscholar.org/paper/6b5d1e50894b1f28e4798cf20e9ffa88b9ec011a"
"9360390b02b9a09ece9a2486055b17e18dc5d3f6",2,"Automatic Code Documentation Generation Using GPT-3","Codec is a GPT-3 based model pre-trained on both natural and programming languages that outperforms existing techniques even with basic settings like one-shot learning and achieves an overall BLEU score of 20.6 for six different programming languages.","International Conference on Automated Software Engineering",2022,"Junaed Younus Khan,Gias Uddin",0,60,0,"https://www.semanticscholar.org/paper/9360390b02b9a09ece9a2486055b17e18dc5d3f6"
"363758e9e296adc9391ed731e834809cf5d4c19b",2,"Are machine programming systems using right source-code measures to select code repositories?","A framework to rank open-source repositories on quality, maintainability, and popularity by leveraging existing research on this topic is developed and some correlation between the quality measures used in GitRank and ControlFlag's performance is revealed, suggesting that some of the measures used by GitRank are applicable to ControlFlag.","MaLTeSQuE@ESEC/SIGSOFT FSE",2022,"N. Hasabnis",1,32,0,"https://www.semanticscholar.org/paper/363758e9e296adc9391ed731e834809cf5d4c19b"
"cd6496bc404e18a24f634e3dded2ed1cdca03e0f",2,"Learning to Learn with Generative Models of Neural Network Checkpoints","This model is a conditional diffusion transformer that, given an initial input parameter vector and a prompted loss, error, or return, predicts the distribution over parameter updates that achieve the desired metric.","ArXiv",2022,"William S. Peebles,Ilija Radosavovic,Tim Brooks,Alexei A. Efros,J. Malik",7,77,0,"https://www.semanticscholar.org/paper/cd6496bc404e18a24f634e3dded2ed1cdca03e0f"
"55e3fe05598be7c3dd357d51166869f6571b824f",2,"Large Language Models are Pretty Good Zero-Shot Video Game Bug Detectors","This study explores the possibil-ity of leveraging the zero-shot capabilities of large language models for video game bug detection by formulating the bug detection problem as a question-answering task, and shows thatLarge language models can identify which event is buggy in a sequence of textual descriptions of events from a game.","ArXiv",2022,"Mohammad Reza Taesiri,F. Macklon,Yihe Wang,Hengshuo Shen,C. Bezemer",0,51,0,"https://www.semanticscholar.org/paper/55e3fe05598be7c3dd357d51166869f6571b824f"
"62f0db3a5ad5c795ec18fc7a6e7b01836809df57",2,"Language Models are Multilingual Chain-of-Thought Reasoners","It is shown that the multilingual reasoning abilities of language models extend to other tasks such as commonsense reasoning and word-in-context semantic judgment, and that models have strikingly strong mult bilingual reasoning abilities, even in underrepresented languages such as Bengali and Swahili.","ArXiv",2022,"Freda Shi,Mirac Suzgun,Markus Freitag,Xuezhi Wang,Suraj Srivats,Soroush Vosoughi,Hyung Won Chung,Yi Tay,Sebastian Ruder,Denny Zhou,Dipanjan Das,Jason Wei",15,50,1,"https://www.semanticscholar.org/paper/62f0db3a5ad5c795ec18fc7a6e7b01836809df57"
"259b7a01700c39d5669e88d1434873ea38a13528",2,"In-Context Policy Iteration","An algorithm, ICPI, that learns to perform RL tasks without expert demonstrations or gradients, and is presented as a policy-iteration method in which the prompt content is the entire locus of learning.","ArXiv",2022,"Ethan Brooks,Logan Walls,Richard L. Lewis,Satinder Singh",0,39,0,"https://www.semanticscholar.org/paper/259b7a01700c39d5669e88d1434873ea38a13528"
"5484d228bfc50efbac6e86677bc2ec2ee4ede1a6",2,"Scaling Instruction-Finetuned Language Models","This result shows that instruction and UL2 continued pre-training are complementary compute-eﬃcient methods to improve the performance of language models without increasing model scale.","ArXiv",2022,"Hyung Won Chung,Le Hou,S. Longpre,Barret Zoph,Yi Tay,W. Fedus,Eric Li,Xuezhi Wang,M. Dehghani,Siddhartha Brahma,Albert Webson,S. Gu,Zhuyun Dai,Mirac Suzgun,Xinyun Chen,Aakanksha Chowdhery,Dasha Valter,Sharan Narang,Gaurav Mishra,A. Yu,Vincent Zhao,Yanping Huang,Andrew M. Dai,Hongkun Yu,Slav Petrov,E. Chi,J. Dean,Jacob Devlin,Adam Roberts,Denny Zhou,Quoc Le,Jason Wei",30,104,8,"https://www.semanticscholar.org/paper/5484d228bfc50efbac6e86677bc2ec2ee4ede1a6"
"d26f616699a122e5455a13189e276002ee4cf923",2,"Draft, Sketch, and Prove: Guiding Formal Theorem Provers with Informal Proofs","This work introduces Draft, Sketch, and Prove (DSP), a method that maps informal proofs to formal proof sketches, and uses the sketches to guide an automated prover by directing its search to easier sub-problems.","ArXiv",2022,"Albert Qiaochu Jiang,S. Welleck,J. Zhou,Wenda Li,Jiacheng Liu,M. Jamnik,Timothée Lacroix,Yuhuai Wu,Guillaume Lample",2,40,0,"https://www.semanticscholar.org/paper/d26f616699a122e5455a13189e276002ee4cf923"
"472d87be3dc298102e058be55a814cc6d2085b39",2,"Towards Deceptive Defense in Software Security with Chaff Bugs","A new defensive technique called chaff bugs is proposed, which instead targets the bug discovery and exploit creation stages of this process, and can serve as an effective deterrent against both human attackers and automated bug-finding tools.","International Symposium on Recent Advances in Intrusion Detection",2022,"Zhenghao Hu,Yu Hu,Brendan Dolan-Gavitt",0,47,0,"https://www.semanticscholar.org/paper/472d87be3dc298102e058be55a814cc6d2085b39"
"ac3d7ae8b4acb137492d4a8d8bcff480b89fa000",2,"Programming Pedagogy and Assessment in the Era of AI/ML: A Position Paper","This work surveys recent research on automated systems for writing code, and examines the components of the code-writing task using a six-step framework proposed in the literature, and identifies the impact of automated systems at each step.","Compute",2022,"A. Raman,Viraj Kumar",0,39,0,"https://www.semanticscholar.org/paper/ac3d7ae8b4acb137492d4a8d8bcff480b89fa000"
"632ab7663e6d64578ceda1d1df9ec525b503bacb",2,"Steps towards prompt-based creation of virtual worlds","This work shows that prompt-based methods can both accelerate in-VR level editing, as well as can become part of gameplay rather than just part of game development.","ArXiv",2022,"Jasmine Roberts,Andrzej Banburski-Fahey,J. Lanier",0,41,0,"https://www.semanticscholar.org/paper/632ab7663e6d64578ceda1d1df9ec525b503bacb"
"048ed70192de0232086eb32a95ffb3be8d336c76",2,"Metaphors We Learn By","This essay relates parameter sharing (“weight sharing”) to analogy making and the school of thought of cognitive metaphor, and discusses how recurrent and auto-regressive models can be thought of as extending analogy making from static features to dynamic skills and procedures.","ArXiv",2022,"R. Memisevic",0,36,0,"https://www.semanticscholar.org/paper/048ed70192de0232086eb32a95ffb3be8d336c76"
"888dd5f5a617ac80bcad9a70005cce2bb1efcb81",2,"CLAWSAT: Towards Both Robust and Accurate Code Models","C LAW SAT is developed, a novel self-supervised learning (SSL) framework for code by integrating CL with adversarial views (C LAW ) with staggered adversarial training (SAT), which consistently yields the best robustness and accuracy.","ArXiv",2022,"Jinghan Jia,Shashank Srikant,Tamara Mitrovska,Chuang Gan,Shiyu Chang,Sijia Liu,Una-May O’Reilly",0,52,0,"https://www.semanticscholar.org/paper/888dd5f5a617ac80bcad9a70005cce2bb1efcb81"
"477d0b2abf07ee92732698f9aeb3c784f28ffa88",2,"On the Security Vulnerabilities of Text-to-SQL Models","Vulnerability tests on Text-to-SQL, a technique that builds natural language interfaces for databases, showed that the Text- to-SQL modules of two commercial black boxes can be manipulated to produce malicious code, potentially leading to data breaches and Denial of Service.","ArXiv",2022,"Xutan Peng,Yipeng Zhang,Jingfeng Yang,Mark Stevenson",0,71,0,"https://www.semanticscholar.org/paper/477d0b2abf07ee92732698f9aeb3c784f28ffa88"
"ea55ae4c82b45e3857f37406c94e9f642a2b3d84",2,"Genetic Programming with Local Scoring","New techniques for synthesizing programs through se-quences of mutations, including a method of local scoring assigning a score to each expression in a program, and cyclic evolution in which programs evolve programs through phases of expansion and reduction are presented.","ArXiv",2022,"Max Vistrup",0,9,0,"https://www.semanticscholar.org/paper/ea55ae4c82b45e3857f37406c94e9f642a2b3d84"
"4290a70025f29d7054c550c75ae6b24c38a79d12",2,"SE Factual Knowledge in Frozen Giant Code Model: A Study on FQN and its Retrieval","This work conducts the first systematic study on the SE factual knowledge in the state-of-the-art PCM CoPilot, focusing on APIs’ Fully Qualiﬁed Names (FQNs), the fundamental knowledge for effective code analysis, search and reuse.","ArXiv",2022,"Qing Huang,Dianshu Liao,Zhenchang Xing,Zhiqiang Yuan,Qinghua Lu,Xiwei Xu,Jiaxing Lu",0,74,0,"https://www.semanticscholar.org/paper/4290a70025f29d7054c550c75ae6b24c38a79d12"
"ae441f7305dc2cd58c708528b3ecee3501cc5c46",2,"Plansformer: Generating Symbolic Plans using Transformers","The use of LLMs for automated planning - a branch of AI concerned with the realization of action sequences (plans) to achieve a goal, typically executed by intelligent agents, autonomous robots, and unmanned vehicles are explored.","ArXiv",2022,"Vishal Pallagani,Bharath Muppasani,K. Murugesan,F. Rossi,L. Horesh,Biplav Srivastava,F. Fabiano,Andrea Loreggia",0,36,0,"https://www.semanticscholar.org/paper/ae441f7305dc2cd58c708528b3ecee3501cc5c46"
"3b8ccc7ec80b8775de603e248ac1ca2b919d6b70",2,"Chatbots in a Botnet World","Questions-and-answer formats provide a novel experimental platform for investigating cybersecurity questions and illustrate cases that support the broad gain of functionality, including self-replication and self-modification, evasion, and strategic understanding of complex cybersecurity goals.","ArXiv",2022,"Forrest McKee,David Noever",2,29,0,"https://www.semanticscholar.org/paper/3b8ccc7ec80b8775de603e248ac1ca2b919d6b70"
"6756fcd998caeb7b23702e08559e63710179334c",2,"Reasoning with Language Model Prompting: A Survey","This paper provides a comprehensive survey of cutting-edge research on reasoning with language model prompting and introduces research works with comparisons and summaries and provides systematic resources to help beginners.","ArXiv",2022,"Shuofei Qiao,Yixin Ou,Ningyu Zhang,Xiang Chen,Yunzhi Yao,Shumin Deng,Chuanqi Tan,Fei Huang,Huajun Chen",5,150,0,"https://www.semanticscholar.org/paper/6756fcd998caeb7b23702e08559e63710179334c"
"a8e0ba16346b72c3a04dd0b1da84bc5f28900174",2,"Using GitHub Copilot to Solve Simple Programming Problems","Evaluating Copilot, a natural language machine learning model trained on billions of lines of code, and looking qualitatively at the generated suggestions, to understand the limitations of Copilot.","",2023,"M. Wermelinger",1,15,1,"https://www.semanticscholar.org/paper/a8e0ba16346b72c3a04dd0b1da84bc5f28900174"
"490f1e8ff352bded30bcde01d5b4769d6c2d2dd5",2,"Adversarial Attacks on Neural Models of Code via Code Difference Reduction","This work proposes a novel adversarial attack technique, CODA, that uses the code differences between the target input and reference inputs to guide the generation of adversarial examples and considers both structure differences and identiﬁer differences to preserve the original semantics.","ArXiv",2023,"Zhao Tian,Junjie Chen,Zhi Jin",0,48,0,"https://www.semanticscholar.org/paper/490f1e8ff352bded30bcde01d5b4769d6c2d2dd5"
