"id","score","title","summary","venue","year","authors","citationCount","referenceCount","influentialCitationCount","url"
"0efa0441da820b1905572666ba1974a06a9663fb",3,"NaturalProver: Grounded Mathematical Proof Generation with Language Models","N ATURAL P ROVER is capable of proving some theorems that require short (2-6 step) proofs, and providing next-step suggestions that are rated as correct and useful over 40% of the time, which is to the authors' knowledge the first demonstration of these capabilities using neural language models.","ArXiv",2022,"S. Welleck,Jiacheng Liu,Ximing Lu,Hannaneh Hajishirzi,Yejin Choi",6,53,0,"https://www.semanticscholar.org/paper/0efa0441da820b1905572666ba1974a06a9663fb"
"0d08ffccc982781e310bb184397bbe64b9aef157",3,"Automatic Generation of Programming Exercises and Code Explanations Using Large Language Models","The analysis suggests that there is significant value in massive generative machine learning models as a tool for instructors, although there remains a need for some oversight to ensure the quality of the generated content before it is delivered to students.","International Computing Education Research Workshop",2022,"Sami Sarsa,Paul Denny,Arto Hellas,Juho Leinonen",18,99,1,"https://www.semanticscholar.org/paper/0d08ffccc982781e310bb184397bbe64b9aef157"
"2edc8efcda27c944a46f367acf6a5280b8f65525",3,"FixEval: Execution-based Evaluation of Program Fixes for Competitive Programming Problems","This work introduces F IX E VAL, a benchmark comprising of buggy code submissions to competitive programming problems and their respective ﬁxes, and believes it provides a step towards real-world automatic bugﬁxing and model-generated code evaluation.","ArXiv",2022,"Md. Mahim Anjum Haque,W. Ahmad,Ismini Lourentzou,Chris Brown",0,56,0,"https://www.semanticscholar.org/paper/2edc8efcda27c944a46f367acf6a5280b8f65525"
"ab0e3d3e4d42369de5933a3b4c237780b41c0d77",3,"Solving Quantitative Reasoning Problems with Language Models","","ArXiv",2022,"Aitor Lewkowycz,Anders Andreassen,David Dohan,Ethan Dyer,H. Michalewski,V. Ramasesh,Ambrose Slone,Cem Anil,Imanol Schlag,Theo Gutman-Solo,Yuhuai Wu,Behnam Neyshabur,Guy Gur-Ari,Vedant Misra",72,51,14,"https://www.semanticscholar.org/paper/ab0e3d3e4d42369de5933a3b4c237780b41c0d77"
"99f85119f113b5498517928eff74a904b69e37b7",3,"CCTEST: Testing and Repairing Code Completion Systems","This research proposes CCT EST, a framework to test and repair code completion systems in black-box settings, which features a set of novel mutation strategies, namely program structure-consistent (PSC) mutations, to generate mutated code completion inputs.","ArXiv",2022,"Zongjie Li,Chaozheng Wang,Zhibo Liu,Haoxuan Wang,Shuai Wang,Cuiyun Gao",1,81,0,"https://www.semanticscholar.org/paper/99f85119f113b5498517928eff74a904b69e37b7"
"95fa2b27ab7eb84738441ee16da97323538938f9",3,"I Speak, You Verify: Toward Trustworthy Neural Program Synthesis","An approach for improving the trustworthiness and overall accuracy of program synthesizers based on large language models for source code by analyzing the agreement between programs and predicates to judge both which program is most likely to be correct and whether the language model is able to solve the programming problem in the first place.","ArXiv",2022,"Darren Key,Wen-Ding Li,Kevin Ellis",0,34,0,"https://www.semanticscholar.org/paper/95fa2b27ab7eb84738441ee16da97323538938f9"
"0b8772b7790c69f40897b5eb7f8fd57f24138f3d",3,"ContraGen: Effective Contrastive Learning For Causal Language Model","It is shown that C ONTRA G EN can effectively enhance both uniformity and discrimination of the representations and lead to the desired improvement on various language understanding tasks where discriminative representations are crucial for attaining good performance.","ArXiv",2022,"Nihal Jain,Dejiao Zhang,Wasi Uddin Ahmad,Zijian Wang,Feng Nan,Xiaopeng Li,M. Tan,Ramesh Nallapati,Baishakhi Ray,Parminder Bhatia,Xiaofei Ma,Bing Xiang",0,66,0,"https://www.semanticscholar.org/paper/0b8772b7790c69f40897b5eb7f8fd57f24138f3d"
"0c78a473e33a81246d5c0fbbda7e7de168814c18",3,"FlexType: A Plug-and-Play Framework for Type Inference Models","This work introduces FlexType, an IDE extension that can be used on both JavaScript and TypeScript to infer types in an interactive or automatic fashion and believes the interactive Visual Studio Code extension is inherently useful in both TypeScript and JavaScript especially when resolving types is taxing for the developer.","International Conference on Automated Software Engineering",2022,"Sivani Voruganti,Kevin Jesse,Prem Devanbu",0,39,0,"https://www.semanticscholar.org/paper/0c78a473e33a81246d5c0fbbda7e7de168814c18"
"663a41c866d49ce052801fbc88947d39764cad29",3,"Challenging BIG-Bench Tasks and Whether Chain-of-Thought Can Solve Them","It is found that applying chain-of-thought (CoT) prompting to BBH tasks enables PaLM to surpass the average human-rater performance on 10 of the 23 tasks, and Codex to surpass it on 17 of the23 tasks.","ArXiv",2022,"Mirac Suzgun,Nathan Scales,Nathanael Scharli,Sebastian Gehrmann,Yi Tay,Hyung Won Chung,Aakanksha Chowdhery,Quoc V. Le,E. Chi,Denny Zhou,Jason Wei",23,55,5,"https://www.semanticscholar.org/paper/663a41c866d49ce052801fbc88947d39764cad29"
"8ffe7b7eeddbd4c22d642b0a48379d17e61c3bab",3,"Soft-Labeled Contrastive Pre-training for Function-level Code Representation","This paper presents SCodeR, aoft-labeled contrastive pre-training framework with two positive sample construction methods to learn functional-level code representation and shows the effectiveness of the proposed pre- training method.","Conference on Empirical Methods in Natural Language Processing",2022,"Xiaonan Li,Daya Guo,Yeyun Gong,Yun Lin,Yelong Shen,Xipeng Qiu,Daxin Jiang,Weizhu Chen,Nan Duan",2,42,0,"https://www.semanticscholar.org/paper/8ffe7b7eeddbd4c22d642b0a48379d17e61c3bab"
"4c2534f9b03ac2f3810c07abc398a11bcf47258e",3,"Transformers Learn Shortcuts to Automata","The theoretical results completely characterize shortcut solutions, whereby a shallow Transformer with only o(T ) layers can exactly replicate the computation of an automaton on an input sequence of length T .","ArXiv",2022,"Bingbin Liu,J. Ash,Surbhi Goel,A. Krishnamurthy,Cyril Zhang",4,104,0,"https://www.semanticscholar.org/paper/4c2534f9b03ac2f3810c07abc398a11bcf47258e"
"f031ba42cf82f106200bb03fbb91dd5671a59b9c",3,"Practical Program Repair in the Era of Large Pre-trained Language Models","This study demonstrates that directly applying state-of-the-art PLMs can already substantially outperform all existing APR techniques on all the authors' datasets and shows that PLM-based APR can be further substantially boosted via: increasing the sample size, and incorporating inﬁx template information.","ArXiv",2022,"Chun Xia,Yuxiang Wei,Lingming Zhang",3,69,0,"https://www.semanticscholar.org/paper/f031ba42cf82f106200bb03fbb91dd5671a59b9c"
"2abed82162c47a0cc32cd62afcf46b0745541017",3,"Experiences from Using Code Explanations Generated by Large Language Models in a Web Software Development E-Book","The preliminary results show that all varieties of explanations were viewed by students and that the majority of students perceived the code explanations as helpful to them, however, student engagement appeared to vary by code snippet complexity, explanation type, and code snippet length.","ArXiv",2022,"S. MacNeil,Andrew Tran,Arto Hellas,Joanne Kim,Sami Sarsa,Paul Denny,Seth Bernstein,Juho Leinonen",2,45,0,"https://www.semanticscholar.org/paper/2abed82162c47a0cc32cd62afcf46b0745541017"
"327f1561b544b0a3b9d8d5d0e6d82c2a5911fca9",3,"BLOOM: A 176B-Parameter Open-Access Multilingual Language Model","BLOOM is a 176B-parameter open-access language model designed and built thanks to a collaboration of hundreds of researchers and achieves competitive performance on a wide variety of benchmarks, with stronger results after undergoing multitask prompted finetuning.","ArXiv",2022,"Teven Le Scao,Angela Fan,Christopher Akiki,Elizabeth-Jane Pavlick,Suzana Ili'c,Daniel Hesslow,Roman Castagn'e,A. Luccioni,Franccois Yvon,Matthias Gallé,J. Tow,Alexander M. Rush,Stella Rose Biderman,Albert Webson,Pawan Sasanka Ammanamanchi,Thomas Wang,Benoît Sagot,Niklas Muennighoff,Albert Villanova del Moral,Olatunji Ruwase,Rachel Bawden,Stas Bekman,Angelina McMillan-Major,Iz Beltagy,Huu Nguyen,Lucile Saulnier,Samson Tan,Pedro Ortiz Suarez,Victor Sanh,Hugo Laurenccon,Yacine Jernite,Julien Launay,Margaret Mitchell,Colin Raffel,Aaron Gokaslan,Adi Simhi,Aitor Soroa Etxabe,Alham Fikri Aji,Amit Alfassy,Anna Rogers,Ariel Kreisberg Nitzav,Canwen Xu,Chenghao Mou,Chris C. Emezue,Christopher Klamm,Colin Leong,Daniel Alexander van Strien,David Ifeoluwa Adelani,Dragomir R. Radev,Eduardo G. Ponferrada,Efrat Levkovizh,Ethan Kim,E. Natan,F. Toni,Gérard Dupont,Germán Kruszewski,Giada Pistilli,Hady ElSahar,Hamza Benyamina,Hieu Tran,Ian Yu,Idris Abdulmumin,Isaac Johnson,Itziar Gonzalez-Dios,Javier de la Rosa,Jenny Chim,Jesse Dodge,Jian Zhu,Jonathan Chang,Jorg Frohberg,Josephine L. Tobing,J. Bhattacharjee,Khalid Almubarak,Kimbo Chen,Kyle Lo,Leandro von Werra,Leon Weber,Long Phan,Loubna Ben Allal,Ludovic Tanguy,Manan Dey,M. Muñoz,Maraim Masoud,Mar'ia Grandury,Mario vSavsko,Max Huang,Maximin Coavoux,Mayank Singh,Mike Tian-Jian Jiang,Minh Chien Vu,M. A. Jauhar,Mustafa Ghaleb,Nishant Subramani,Nora Kassner,Nurulaqilla Khamis,Olivier Nguyen,Omar Espejel,Ona de Gibert,Paulo Villegas,Peter Henderson,Pierre Colombo,Priscilla Amuok,Quentin Lhoest,Rheza Harliman,Rishi Bommasani,R. L'opez,Rui Ribeiro,Salomey Osei,Sampo Pyysalo,Sebastian Nagel,Shamik Bose,Shamsuddeen Hassan Muhammad,Shanya Sharma,S. Longpre,Somaieh Nikpoor,Stanislav Silberberg,S. Pai,S. Zink,Tiago Timponi Torrent,Timo Schick,Tristan Thrush,V. Danchev,Vassilina Nikoulina,Veronika Laippala,Violette Lepercq,V. Prabhu,Zaid Alyafeai,Zeerak Talat,Arun Raja,Benjamin Heinzerling,Chenglei Si,Elizabeth Salesky,Sabrina J. Mielke,Wilson Y. Lee,Abheesht Sharma,Andrea Santilli,Antoine Chaffin,Arnaud Stiegler,Debajyoti Datta,Eliza Szczechla,Gunjan Chhablani,Han Wang,Harshit Pandey,Hendrik Strobelt,Jason Alan Fries,Jos Rozen,Leo Gao,Lintang Sutawika,M Saiful Bari,Maged S. Al-shaibani,Matteo Manica,Nihal V. Nayak,Ryan Teehan,Samuel Albanie,Sheng Shen,Srulik Ben-David,Stephen H. Bach,Taewoon Kim,T. Bers,Thibault Févry,Trishala Neeraj,Urmish Thakker,Vikas Raunak,Xiang Tang,Zheng Xin Yong,Zhiqing Sun,Shaked Brody,Y. Uri,Hadar Tojarieh,Adam Roberts,Hyung Won Chung,Jaesung Tae,Jason Phang,Ofir Press,Conglong Li,D. Narayanan,Hatim Bourfoune,J. Casper,Jeff Rasley,Max Ryabinin,Mayank Mishra,Minjia Zhang,M. Shoeybi,Myriam Peyrounette,N. Patry,Nouamane Tazi,Omar Sanseviero,Patrick von Platen,Pierre Cornette,Pierre Franccois Lavall'ee,R. Lacroix,Samyam Rajbhandari,Sanchit Gandhi,Shaden Smith,S. Requena,Suraj Patil,Tim Dettmers,Ahmed Baruwa,Amanpreet Singh,Anastasia Cheveleva,Anne-Laure Ligozat,Arjun Subramonian,Aur'elie N'ev'eol,Charles Lovering,Daniel H Garrette,D. Tunuguntla,Ehud Reiter,Ekaterina Taktasheva,E. Voloshina,Eli Bogdanov,Genta Indra Winata,Hailey Schoelkopf,Jan-Christoph Kalo,Jekaterina Novikova,J. Forde,Jordan Clive,Jungo Kasai,Ken Kawamura,Liam Hazan,Marine Carpuat,Miruna Clinciu,Najoung Kim,Newton Cheng,Oleg Serikov,Omer Antverg,Oskar van der Wal,Rui Zhang,Ruochen Zhang,Sebastian Gehrmann,S. Pais,Tatiana Shavrina,Thomas Scialom,Tian Yun,Tomasz Limisiewicz,Verena Rieser,Vitaly Protasov,V. Mikhailov,Yada Pruksachatkun,Yonatan Belinkov,Zachary Bamberger,Zdenvek Kasner,Alice Rueda,Amanda Pestana,A. Feizpour,Ammar Khan,Amy Faranak,A. Santos,A. Hevia,Antigona Unldreaj,Arash Aghagol,Arezoo Abdollahi,A. Tammour,Azadeh HajiHosseini,Bahareh Behroozi,B. Ajibade,B. Saxena,Carlos Muñoz Ferrandis,Danish Contractor,D. Lansky,Davis David,Douwe Kiela,D. A. Nguyen,Edward Tan,Emily Baylor,Ezinwanne Ozoani,Fatim T Mirza,Frankline Ononiwu,Habib Rezanejad,H.A. Jones,Indrani Bhattacharya,Irene Solaiman,Irina Sedenko,I. Nejadgholi,J. Passmore,Joshua Seltzer,Julio Bonis Sanz,Karen Fort,L. Dutra,Mairon Samagaio,Maraim Elbadri,M. Mieskes,Marissa Gerchick,Martha Akinlolu,Michael McKenna,Mike Qiu,M. Ghauri,Mykola Burynok,Nafis Abrar,Nazneen Rajani,Nour Elkott,N. Fahmy,O. Samuel,Ran An,R. Kromann,Ryan Hao,S. Alizadeh,Sarmad Shubber,Silas L. Wang,Sourav Roy,S. Viguier,Thanh-Cong Le,Tobi Oyebade,T. Le,Yoyo Yang,Z. Nguyen,Abhinav Ramesh Kashyap,Alfredo Palasciano,A. Callahan,Anima Shukla,Antonio Miranda-Escalada,A. Singh,Benjamin Beilharz,Bo Wang,C. Brito,Chenxi Zhou,Chirag Jain,Chuxin Xu,Clémentine Fourrier,Daniel Le'on Perin'an,Daniel Molano,Dian Yu,Enrique Manjavacas,Fabio Barth,Florian Fuhrimann,Gabriel Altay,Giyaseddin Bayrak,Gully A. Burns,Helena U. Vrabec,I. Bello,Isha Dash,J. Kang,John Giorgi,J. Golde,J. Posada,Karthi Sivaraman,Lokesh Bulchandani,Lu Liu,Luisa Shinzato,Madeleine Hahn de Bykhovetz,Maiko Takeuchi,Marc Pàmies,M. A. Castillo,Marianna Nezhurina,Mario Sanger,M. Samwald,Michael Cullan,Michael Weinberg,M. Wolf,Mina Mihaljcic,Minna Liu,M. Freidank,Myungsun Kang,Natasha Seelam,N. Dahlberg,N. Broad,N. Muellner,Pascale Fung,Patricia Haller,R. Chandrasekhar,R. Eisenberg,Robert Martin,Rodrigo L. Canalli,Rosaline Su,Ruisi Su,Samuel Cahyawijaya,Samuele Garda,Shlok S Deshmukh,Shubhanshu Mishra,Sid Kiblawi,Simon Ott,Sinee Sang-aroonsiri,Srishti Kumar,Stefan Schweter,S. Bharati,T. A. Laud,Th'eo Gigant,Tomoya Kainuma,Wojciech Kusa,Yanis Labrak,Yashasvi Bajaj,Y. Venkatraman,Yifan Xu,Ying Xu,Yun-chao Xu,Z. Tan,Zhongli Xie,Zifan Ye,M. Bras,Younes Belkada,Thomas Wolf",48,157,7,"https://www.semanticscholar.org/paper/327f1561b544b0a3b9d8d5d0e6d82c2a5911fca9"
"a4bdc300db297756f36bedee2859b62df8e268c2",3,"Follow the Wisdom of the Crowd: Effective Text Generation via Minimum Bayes Risk Decoding","This work presents crowd sampling, a family of decoding methods based on Bayesian risk minimization, to ad-dress this diversity-quality trade-off in open-ended natural-language generation.","ArXiv",2022,"Mirac Suzgun,Luke Melas-Kyriazi,Dan Jurafsky",3,83,0,"https://www.semanticscholar.org/paper/a4bdc300db297756f36bedee2859b62df8e268c2"
"20b60fb3993d2e9a5af04611f7bdf248e5a3a736",3,"Programming by Example and Text-to-Code Translation for Conversational Code Generation","Modular Programs for Text-guided Hierarchical Synthesis (MPaTHS), a method for integrating Programming by Example and text-to-code systems which uses an accessible natural language interface for synthesizing general programs, is proposed.","ArXiv",2022,"Eli Whitehouse,William Gerard,Yauhen Klimovich,Marc Franco-Salvador",0,21,0,"https://www.semanticscholar.org/paper/20b60fb3993d2e9a5af04611f7bdf248e5a3a736"
"30624a18720bf93a85dc3efe570df271a8c9f4c3",3,"Program Repair","Keeping intermediate rules, instead of producing the most generalized rule by generalizing all concrete transformations, enables us to apply the most suitable rule to transform a given code.","ArXiv",2022,"Xiang Gao,Yannic Noller,Abhik Roychoudhury",2,105,0,"https://www.semanticscholar.org/paper/30624a18720bf93a85dc3efe570df271a8c9f4c3"
"dca3bc28a7d404b28780a813ea7072eda809e6c0",3,"Programming Is Hard - Or at Least It Used to Be: Educational Opportunities And Challenges of AI Code Generation","It is argued that the community needs to act quickly in deciding what possible opportunities can and should be leveraged and how, while also working on how to overcome or otherwise mitigate the possible challenges.","ArXiv",2022,"Brett A. Becker,Paul Denny,James Finnie-Ansley,Andrew Luxton-Reilly,J. Prather,E. Santos",0,49,0,"https://www.semanticscholar.org/paper/dca3bc28a7d404b28780a813ea7072eda809e6c0"
"42630c03d3817b1153d245f20742ad4b30a80b75",3,"JEMMA: An Extensible Java Dataset for ML4Code Applications","JEMMA is introduced, which is a largescale, diverse, and high-quality dataset targeted at ML4Code applications, and becomes a workbench that researchers can use to experiment with novel representations and tasks operating on source code.","ArXiv",2022,"Anjan Karmakar,Miltiadis Allamanis,R. Robbes",0,93,0,"https://www.semanticscholar.org/paper/42630c03d3817b1153d245f20742ad4b30a80b75"
"bf5fbd690f24f873df86d1b0a06579cf42f7dc36",3,"Dialog2API: Task-Oriented Dialogue with API Description and Example Programs","An approach tailored for the Dialog2API, where the dialogue states are represented by a stack of programs, with most recently mentioned program on the top of the stack, is proposed.","ArXiv",2022,"Raphael Shu,Elman Mansimov,Tamer Alkhouli,Nikolaos Pappas,Salvatore Romeo,Arshit Gupta,Saab Mansour,Yi Zhang,D. Roth",0,32,0,"https://www.semanticscholar.org/paper/bf5fbd690f24f873df86d1b0a06579cf42f7dc36"
"c532f1df90925e5c69789f0cd99248d8a2a2e5bc",3,"My AI Wants to Know if This Will Be on the Exam: Testing OpenAI’s Codex on CS2 Programming Exercises","This paper presents results detailing how Codex performs on more advanced CS2 exam questions taken from past exams, and compares these results to those of students who took the same exams under normal conditions, demonstrating that Codex outscores most students.","IFAC Symposium on Advances in Control Education",2023,"James Finnie-Ansley,Paul Denny,Andrew Luxton-Reilly,E. Santos,J. Prather,Brett A. Becker",1,27,0,"https://www.semanticscholar.org/paper/c532f1df90925e5c69789f0cd99248d8a2a2e5bc"
"e73a16490c29530c37b49f6a30592790e7caaaa4",2,"Don't Complete It! Preventing Unhelpful Code Completion for Productive and Sustainable Neural Code Completion Systems","An early-rejection mechanism to turn down low-return prompts by foretelling the code completion qualities without sending them to the codepletion system is proposed and a lightweight Transformer-based estimator is proposed to demonstrate the feasibility of the mechanism.","",2022,"Zhensu Sun,Xiaoning Du,Fu Song,Shangwen Wang,Mingze Ni,Li Li",0,33,0,"https://www.semanticscholar.org/paper/e73a16490c29530c37b49f6a30592790e7caaaa4"
"f0ea9e2d3889d37f34743ed1dc64f11e8e0484de",2,"Numeracy from Literacy: Data Science as an Emergent Skill from Large Language Models","The work examines whether next-token prediction succeeds from sentence completion into the realm of actual numerical understanding and showcases the model's capabilities to group by or pivot categorical sums, infer feature importance, derive correlations, and predict unseen test cases using linear regression.","ArXiv",2023,"David Noever,Forrest McKee",0,43,0,"https://www.semanticscholar.org/paper/f0ea9e2d3889d37f34743ed1dc64f11e8e0484de"
"b0335eb2b9a1684fc16ff79234f0b206b30da169",2,"A Study of Editor Features in a Creative Coding Classroom","An experimental editor is implemented and used to teach a sequence of college and high-school creative coding courses to identify opportunities to improve creativity- and novice-focused IDEs and highlight ten-sions in their design.","ArXiv",2023,"Andrew M. McNutt,Anton Outkine,Ravi Chugh",0,107,0,"https://www.semanticscholar.org/paper/b0335eb2b9a1684fc16ff79234f0b206b30da169"
"0bc2753f59e653de718b5c7a2a0a7e00d13778c7",2,"NL2CMD: An Updated Workflow for Natural Language to Bash Commands Translation","A state-of-the-art translation model used to generate Bash Commands from the corresponding English text is described and a new NL2CMD dataset is introduced that is automatically generated, involves minimal human intervention, and is over six times larger than prior datasets.","",2022,"Quchen Fu,Zhongwei Teng,Marco Georgaklis,Jules White,Douglas,C. Schmidt",0,77,0,"https://www.semanticscholar.org/paper/0bc2753f59e653de718b5c7a2a0a7e00d13778c7"
"d388b3cbc820975da21c57c9fb9cef2d9c6d08f0",2,"CodeRetriever: Large-scale Contrastive Pre-training for Code Search","","",2022,"Xiaonan Li,Yeyun Gong,Yelong Shen,Xipeng Qiu,Hang Zhang,Bolun Yao,Weizhen Qi,Daxin Jiang,Weizhu Chen,Nan Duan",0,43,0,"https://www.semanticscholar.org/paper/d388b3cbc820975da21c57c9fb9cef2d9c6d08f0"
"22df866f9605d27d1e5cca9b3ab721f33673e158",2,"ProgramTransformer: A tool for generating semantically equivalent transformed programs","","Softw. Impacts",2022,"Md Rafiqul Islam Rabin,Mohammad Amin Alipour",0,26,0,"https://www.semanticscholar.org/paper/22df866f9605d27d1e5cca9b3ab721f33673e158"
"862c0b672c9defded3111924310a07760cfa27ff",2,"Can NMT Understand Me? Towards Perturbation-based Evaluation of NMT Models for Code Generation","This work identifies a set of perturbations and metrics tailored for the robustness assessment of NMT models, and presents a preliminary experimental evaluation, showing what type of perturbedations affect the model the most and deriving useful insights for future directions.","2022 IEEE/ACM 1st International Workshop on Natural Language-Based Software Engineering (NLBSE)",2022,"Pietro Liguori,Cristina Improta,S. D. Vivo,R. Natella,B. Cukic,Domenico Cotroneo",1,58,0,"https://www.semanticscholar.org/paper/862c0b672c9defded3111924310a07760cfa27ff"
"24c5450d8fa785e5f85d9427d2d65cf66476ac3a",2,"Toward General Design Principles for Generative AI Applications","","ArXiv",2023,"Justin D. Weisz,Michael J. Muller,Jessica He,Stephanie Houde",0,115,0,"https://www.semanticscholar.org/paper/24c5450d8fa785e5f85d9427d2d65cf66476ac3a"
"2ad6b59ff14d6bec3f14d8b6480025bbebc50e46",2,"Optimal Neural Program Synthesis from Multimodal Specifications","The experimental results on a multimodal synthesis dataset show that the proposed optimal neural synthesis approach substantially outperforms prior state-of-the-art techniques in terms of accuracy %, finds model-optimal programs more frequently, and explores fewer states during search.","Conference on Empirical Methods in Natural Language Processing",2020,"Xi Ye,Qiaochu Chen,Işil Dillig,Greg Durrett",8,48,0,"https://www.semanticscholar.org/paper/2ad6b59ff14d6bec3f14d8b6480025bbebc50e46"
"6df98ac2300c6e9c232440147ba976b4f501ca67",2,"C ODEX HACKS H ACKER R ANK : B ENEFITS AND R ISKS OF L ARGE -S CALE S OURCE C ODE M ODELS","These studies evaluate Codex on code synthesis, similar to the approach, but their evaluation efforts remain limited to math problems.","",2022,"",0,56,0,"https://www.semanticscholar.org/paper/6df98ac2300c6e9c232440147ba976b4f501ca67"
"cc80244d69c2c5bb7fe79fc6ca2561f2bed830ca",2,"Learning to Represent Programs with Heterogeneous Graphs","This paper proposes the heterogeneous program graph (HPG), which provides the types of the nodes and the edges explicitly, and employs the heterogeneity transformer (HGT) architecture to generate representations based on HPG, considering the type of information during processing.","IEEE International Conference on Program Comprehension",2020,"Wenhan Wang,Kechi Zhang,Ge Li,Zhi Jin",15,70,3,"https://www.semanticscholar.org/paper/cc80244d69c2c5bb7fe79fc6ca2561f2bed830ca"
"c125b0be73c8493ebc27beb572f6c1b21d6b4ae4",2,"Static Prediction of Runtime Errors by Learning to Execute Programs with External Resource Descriptions","Surprisingly, it is shown that the model can also predict the location of the error, despite being trained only on labels indicating the presence/absence and kind of error.","ArXiv",2022,"David Bieber,Rishab Goel,Daniel Zheng,H. Larochelle,Daniel Tarlow",2,36,0,"https://www.semanticscholar.org/paper/c125b0be73c8493ebc27beb572f6c1b21d6b4ae4"
"703f79763d534dbf9674132cec890f432dcc19ec",2,"A Survey of Deep Learning Models for Structural Code Understanding","This survey presents a comprehensive overview of the structures formed from code data, categorizing the models for understanding code in recent years into two groups: sequence-based and graph-based models, and makes some suggestions for future research in structural code understanding field.","ArXiv",2022,"Ruoting Wu,Yu-xin Zhang,Qibiao Peng,Liang Chen,Zibin Zheng",1,180,0,"https://www.semanticscholar.org/paper/703f79763d534dbf9674132cec890f432dcc19ec"
"713bd2971116098211ef06336dfbe91a69854404",2,"Probing Semantic Grounding in Language Models of Code with Representational Similarity Analysis","This paper probes representations from the CodeBERT model for semantic grounding by using the data from the IBM CodeNet dataset, and shows that using bimodalinputs over unimodal inputs gives better semantic grounding and sample eﬃciency during semantic ﬁne-tuning.","International Conference on Advanced Data Mining and Applications",2022,"Shounak Naik,Rajaswa Patil,Swati Agarwal,V. Baths",0,18,0,"https://www.semanticscholar.org/paper/713bd2971116098211ef06336dfbe91a69854404"
"27e3ca4fd7b8290a0e12ca4fd2b7ad5bcd5900f2",2,"Are Transformers All That Karel Needs?","By changing the base architecture to a transformer based one, speciﬁcally GPT2, this work is able to apply simple execution guidance on top to achieve a generalization accurary of 89.64%, which is within 2.36 percentage points of the current state-of-the-art on Karel which uses ensembling.","",2021,"Abhay Garg,Anand Sriraman,Kunal Pagarey,S. Karande",0,37,0,"https://www.semanticscholar.org/paper/27e3ca4fd7b8290a0e12ca4fd2b7ad5bcd5900f2"
"27d16a7f2ce8f2b787b34ff1f9b4fece079700c3",2,"Figuring out Figures: Using Textual References to Caption Scientific Figures","This work uses the S CI C AP datasets curated by Hsu et al. and uses a variant of a CLIP+GPT-2 encoder-decoder model with cross-attention to generate captions conditioned on the image, and uses SciBERT to encode the textual metadata and uses this encoding alongside the figure embedding.","",2022,"Stanley Cao,Kevin Liu",0,25,0,"https://www.semanticscholar.org/paper/27d16a7f2ce8f2b787b34ff1f9b4fece079700c3"
