"id","score","title","summary","venue","year","authors","citationCount","referenceCount","influentialCitationCount","url"
"e8aa5f51aaf29344174f90d7edca49cc153a6b00",1,"Economic impacts of AI-augmented R&D","This work estimates the idea production function for AI in two computer vision tasks that are considered key test-beds for deep learning and suggests that AI-augmented R&D has the potential to speed up technological change and economic growth.","",2022,"T. Besiroglu,Nicholas Emery-Xu,Neil C. Thompson",0,112,0,"https://www.semanticscholar.org/paper/e8aa5f51aaf29344174f90d7edca49cc153a6b00"
"b7823997fb185f208b6a6723b60413ff179d2639",1,"Standing on the Shoulders of AI Giants","","Computer",2023,"Hsiao-Ying Lin",0,12,0,"https://www.semanticscholar.org/paper/b7823997fb185f208b6a6723b60413ff179d2639"
"e42843bfb05263df00837fa1b287bc816296e1fc",1,"Transformers Meet Directed Graphs","This work proposes two direction- and structure-aware positional encodings for directed graphs: the eigenvectors of the Magnetic Laplacian - a direction-aware generalization of the combinatorial LaPLacian; and directional random walkencodings.","ArXiv",2023,"Simon Geisler,Yujia Li,D. Mankowitz,A. Cemgil,Stephan Gunnemann,Cosmin Paduraru",0,42,0,"https://www.semanticscholar.org/paper/e42843bfb05263df00837fa1b287bc816296e1fc"
"be09ed6cd73654a23f78416433a1b23ea623ea79",1,"Symbolic Behaviour in Artificial Intelligence","This work argues that the path towards symbolically fluent artificial intelligence (AI) begins with a reinterpretation of what symbols are, how they come to exist, and how a system behaves when it uses them, and suggests that AI research explore social and cultural engagement as a tool to develop the cognitive machinery necessary for symbolic behaviour to emerge.","ArXiv",2021,"Adam Santoro,Andrew Kyle Lampinen,K. Mathewson,T. Lillicrap,David Raposo",19,139,0,"https://www.semanticscholar.org/paper/be09ed6cd73654a23f78416433a1b23ea623ea79"
"abd77509ef1cc739c0757ae657025fcee13c98dc",1,"Program Synthesis Guided Reinforcement Learning for Partially Observed Environments","This work proposes a new approach, model predictive program synthesis (MPPS), that uses program synthesis to automatically generate the guiding programs for program-guided reinforcement learning without requiring the user to provide a new guiding program for every new task.","Neural Information Processing Systems",2021,"Yichen Yang,J. Inala,O. Bastani,Yewen Pu,Armando Solar-Lezama,M. Rinard",5,83,0,"https://www.semanticscholar.org/paper/abd77509ef1cc739c0757ae657025fcee13c98dc"
"1093adc2a47212ef599e4708fe3e41ff7c9ec6d0",1,"GenLine and GenForm: Two Tools for Interacting with Generative Language Models in a Code Editor","A macro system with two tools that allow users to invoke language model prompts as macros in a code editor, and a form-like interface where the user provides input that is then transformed into multiple pieces of output at the same time.","ACM Symposium on User Interface Software and Technology",2021,"Ellen Jiang,Edwin Toh,A. Molina,Aaron Donsbach,Carrie J. Cai,Michael Terry",6,8,0,"https://www.semanticscholar.org/paper/1093adc2a47212ef599e4708fe3e41ff7c9ec6d0"
"3dc7dc1bea9a4f70c02b6759a0bda7aca0005a9e",1,"A General Language Assistant as a Laboratory for Alignment","A ‘preference model pre-training’ stage of training is studied, with the goal of improving sample efﬁciency when ﬁnetuning on human preferences, and investigating scaling trends for several training objectives relevant to alignment.","ArXiv",2021,"Amanda Askell,Yuntao Bai,Anna Chen,Dawn Drain,Deep Ganguli,T. Henighan,Andy Jones,Nicholas Joseph,Benjamin Mann,Nova DasSarma,Nelson Elhage,Zac Hatfield-Dodds,Danny Hernandez,John Kernion,Kamal Ndousse,Catherine Olsson,Dario Amodei,Tom B. Brown,Jack Clark,Sam McCandlish,C. Olah,Jared Kaplan",53,52,2,"https://www.semanticscholar.org/paper/3dc7dc1bea9a4f70c02b6759a0bda7aca0005a9e"
"4b70f356f50d3e8e1f72c4a10f0ce2a26da95b5a",1,"Controlling Conditional Language Models with Distributional Policy Gradients","The results show that fine-tuning using CDPG robustly moves these pretrained models closer towards meeting control objectives and — in contrast with baseline approaches — does not result in catastrophic forgetting.","ArXiv",2021,"Tomasz Korbak,Hady ElSahar,Germán Kruszewski,Marc Dymetman",0,42,0,"https://www.semanticscholar.org/paper/4b70f356f50d3e8e1f72c4a10f0ce2a26da95b5a"
"54d00fc330248b3b2f89193da31bb17851ebd2b7",1,"M EMORIZING T RANSFORMERS","It is demonstrated that an approximate kNN lookup into a non-differentiable memory of recent (key, value) pairs improves language modeling across various benchmarks and tasks, including generic webtext, math papers, books, code, as well as formal theorems (Isabelle).","",2022,"Memorizing Transformers,Yuhuai Wu,Markus N. Rabe,DeLesley S. Hutchins,Christian Szegedy",0,57,0,"https://www.semanticscholar.org/paper/54d00fc330248b3b2f89193da31bb17851ebd2b7"
"2aec574791fd33e9be32fd5191a66734f805a6a1",1,"Training Language Models with Natural Language Feedback","This work proposes to learn from natural language feedback, which conveys more information per human evaluation, from a GPT-3 model to roughly human-level summarization ability using a three-step learning algorithm.","",2022,"J. Scheurer,Jon Ander Campos,Jun Shern Chan,Angelica Chen,Kyunghyun Cho,Ethan Perez",4,35,0,"https://www.semanticscholar.org/paper/2aec574791fd33e9be32fd5191a66734f805a6a1"
"d3640eb3b542eaf36fee2261f037a6bf0d8eac9c",1,"AI Chains: Transparent and Controllable Human-AI Interaction by Chaining Large Language Model Prompts","Chaining LLM steps together is introduced, where the output of one step becomes the input for the next, thus aggregating the gains per step, and found that Chaining not only improved the quality of task outcomes, but also significantly enhanced system transparency, controllability, and sense of collaboration.","International Conference on Human Factors in Computing Systems",2021,"Tongshuang Sherry Wu,Michael Terry,Carrie J. Cai",36,96,1,"https://www.semanticscholar.org/paper/d3640eb3b542eaf36fee2261f037a6bf0d8eac9c"
"05af6c968ef8c7f9b07b0d67f138780179f29511",1,"Sparks: Inspiration for Science Writing using Language Models","This work presents a system for generating “sparks”, sentences related to a scientific concept intended to inspire writers, and finds three main use cases of sparks—inspiration, translation, and perspective—each of which correlates with a unique interaction pattern.","IN2WRITING",2021,"K. Gero,Vivian Liu,Lydia B. Chilton",8,84,0,"https://www.semanticscholar.org/paper/05af6c968ef8c7f9b07b0d67f138780179f29511"
"edc07f490c1c1b773094f236157219677f6a2f71",1,"Better Modeling the Programming World with Code Concept Graphs-augmented Multi-modal Learning","This paper proposes to enhance an existing pretrained language model of code by joint-learning it with a graph neural network based on a concept graphs based on the idea of leveraging multi-modal learning approaches to modeling the programming world.","2022 IEEE/ACM 44th International Conference on Software Engineering: New Ideas and Emerging Results (ICSE-NIER)",2022,"M. Weyssow,H. Sahraoui,Bang Liu",1,39,0,"https://www.semanticscholar.org/paper/edc07f490c1c1b773094f236157219677f6a2f71"
"0e802c0739771acf70e60d59c2df51cd7e8c50c0",1,"Memorizing Transformers","It is demonstrated that an approximate kNN lookup into a non-differentiable memory of recent (key, value) pairs improves language modeling across various benchmarks and tasks, including generic webtext, math papers, books, code, as well as formal theorems (Isabelle).","International Conference on Learning Representations",2022,"Yuhuai Wu,Markus N. Rabe,DeLesley S. Hutchins,Christian Szegedy",40,57,9,"https://www.semanticscholar.org/paper/0e802c0739771acf70e60d59c2df51cd7e8c50c0"
"9a6730534295335247eebdec59b7decdeb83d59a",1,"On the Transferability of Pre-trained Language Models for Low-Resource Programming Languages","The results show that multilingual PLMs have a lower Performance-to-Time Ratio as compared to monolingual PLMs, and the proposed strategy to select target programming languages to fine-tune mult bilingual PLMs is effective — it reduces the time to Fine-Tune yet achieves higher performance in Code Summarization and Code Search tasks.","IEEE International Conference on Program Comprehension",2022,"Fuxiang Chen,F. Fard,David Lo,T. Bryksin",4,49,0,"https://www.semanticscholar.org/paper/9a6730534295335247eebdec59b7decdeb83d59a"
"fd7c3c8fbe8cf88bd967ead02738b43081e306a7",1,"Training Language Models with Language Feedback","This work proposes to learn from natural language feedback, which conveys more information per human evaluation, from a GPT-3 model to roughly human-level summarization ability using a three-step learning algorithm.","",2022,"J. Scheurer,Jon Ander Campos,Jun Shern Chan,Angelica Chen,Kyunghyun Cho,Ethan Perez",6,43,1,"https://www.semanticscholar.org/paper/fd7c3c8fbe8cf88bd967ead02738b43081e306a7"
"16168520c7efbfa84bcb609a05362916b04022bb",1,"Context-Aware Abbreviation Expansion Using Large Language Models","This work proposes a paradigm in which phrases are abbreviated aggressively as primarily word-initial letters, and aims to expand the abbreviations into full-phrase options by leveraging conversation context with the power of pretrained large language models (LLMs).","North American Chapter of the Association for Computational Linguistics",2022,"Shanqing Cai,Subhashini Venugopalan,Katrin Tomanek,Ajit Narayanan,M. Morris,Michael P. Brenner",3,45,0,"https://www.semanticscholar.org/paper/16168520c7efbfa84bcb609a05362916b04022bb"
"6e10343767ab09dde83cf99ea3442907402a9810",1,"Evaluating the Impact of Model Scale for Compositional Generalization in Semantic Parsing","Limits of current techniques for effectively leveraging model scale for compositional generalization are highlighted, while the analysis also suggests promising directions for future work.","Conference on Empirical Methods in Natural Language Processing",2022,"Linlu Qiu,Peter Shaw,Panupong Pasupat,Tianze Shi,Jonathan Herzig,Emily Pitler,Fei Sha,Kristina Toutanova",10,84,2,"https://www.semanticscholar.org/paper/6e10343767ab09dde83cf99ea3442907402a9810"
"0f86d5ae106a53f40f89b60dff24074f6c2cd127",1,"The Case for a Single Model that can Both Generate Continuations and Fill in the Blank","This work shows that models pre-trained with a F IT B- 012 style objective are capable of both tasks, while model pre- trained for continuation are not, and shows how these models can be easily tuned to allow forained control over the length and word choice of the generation.","NAACL-HLT",2022,"Daphne Ippolito,Liam Dugan,Emily Reif,Ann Yuan,Andy Coenen,Chris Callison-Burch",0,27,0,"https://www.semanticscholar.org/paper/0f86d5ae106a53f40f89b60dff24074f6c2cd127"
"18a831422a4b4c89bbf1cc4baaa2cfcbf29daaf1",1,"Exploring and evaluating personalized models for code generation","This paper explores and evaluates transformer model fine-tuning for personalization in the context of generating unit tests for Java methods, and evaluates learning to personalize to a specific software project using several personalization techniques.","ESEC/SIGSOFT FSE",2022,"Andrei Zlotchevski,Dawn Drain,Alexey Svyatkovskiy,Colin B. Clement,Neel Sundaresan,Michele Tufano",0,31,0,"https://www.semanticscholar.org/paper/18a831422a4b4c89bbf1cc4baaa2cfcbf29daaf1"
"3ee3f425482cf86989d809155cc8cf2bf8d8113e",1,"Understanding HTML with Large Language Models","It is shown that LLMs pretrained on standard natural language corpora transfer re-markably well to HTML understanding tasks, and evidence that T5-based models are ideal due to their bidirectional encoder-decoder architecture is shown.","ArXiv",2022,"Izzeddin Gur,Ofir Nachum,Yingjie Miao,Mustafa Safdari,Austin Huang,Aakanksha Chowdhery,Sharan Narang,Noah Fiedel,Aleksandra Faust",1,29,0,"https://www.semanticscholar.org/paper/3ee3f425482cf86989d809155cc8cf2bf8d8113e"
"13d3733e0dabbb4ccdd036a5f04fd5b3e39eecb0",1,"Vision Transformers provably learn spatial structure","This paper proposes a spatially structured dataset and a simplified ViT model and proposes a mechanism that implicitly learns the spatial structure of the dataset while generalizing, and proves that patch association helps to sample-efficiently transfer to downstream datasets that share the same structure as the pre-training one but differ in the features.","ArXiv",2022,"Samy Jelassi,Michael E. Sander,Yuan-Fang Li",1,77,0,"https://www.semanticscholar.org/paper/13d3733e0dabbb4ccdd036a5f04fd5b3e39eecb0"
"e8db669c8cb1c07557ede15e2771968f9370330b",1,"Large language models are not zero-shot communicators","A simple task is designed and widely used state-of-the-art models are evaluated, finding that, despite only evaluating on utterances that require a binary inference (yes or no), most perform close to random.","ArXiv",2022,"Laura Ruis,Akbir Khan,Stella Rose Biderman,Sara Hooker,Tim Rocktaschel,Edward Grefenstette",2,100,0,"https://www.semanticscholar.org/paper/e8db669c8cb1c07557ede15e2771968f9370330b"
"e7d0a8eb7e98863f37b51d89b5ca305b04aaba99",1,"SemanticOn: Specifying Content-Based Semantic Conditions for Web Automation Programs","SemanticOn is introduced, a system that enables users to specify, refine, and incorporate visual and textual semantic conditions in web automation programs via two methods: natural language description via prompts or information highlighting.","ACM Symposium on User Interface Software and Technology",2022,"Kevin Pu,Rainey Fu,Rui Dong,Xinyu Wang,Yuanchun Chen,Tovi Grossman",0,71,0,"https://www.semanticscholar.org/paper/e7d0a8eb7e98863f37b51d89b5ca305b04aaba99"
"9b5fb07df99b0dd65f3058701d7f017c3a70c144",1,"Leveraging Large Language Models to Power Chatbots for Collecting User Self-Reported Data","This work formulated four prompt designs with different structures and personas to explore what design factors of prompts can help steer chatbots to talk naturally and collect data reliably and discusses the opportunities and challenges of building chatbots with LLMs.","ArXiv",2023,"Jing Wei,Sungdong Kim,Hyunhoon Jung,Young-Ho Kim",0,102,0,"https://www.semanticscholar.org/paper/9b5fb07df99b0dd65f3058701d7f017c3a70c144"
"fd0bccf5e7c1fb5dadd75972e3212554fb255fe2",1,"MISIM: A Neural Code Semantics Similarity System Using the Context-Aware Semantics Structure","This work presents Machine Inferred Code Similarity (MISIM), a neural code semantics similarity system consisting of two core components: a novel context-aware semantics structure, which was purpose-built to lift semantics from code syntax and an extensible neural code similarity scoring algorithm, which can be used for various neural network architectures with learned parameters.","",2020,"Fangke Ye,Sheng-Tian Zhou,Anand Venkat,Ryan Marcus,Nesime Tatbul,Jesmin Jahan Tithi,N. Hasabnis,Paul Petersen,T. Mattson,Tim Kraska,P. Dubey,Vivek Sarkar,Justin Emile Gottschlich",3,62,0,"https://www.semanticscholar.org/paper/fd0bccf5e7c1fb5dadd75972e3212554fb255fe2"
"0c7cb854756f6b69f070a925cd497c2970b136f2",1,"DeSkew-LSH based Code-to-Code Recommendation Engine","Senatus, a new code-to-code recommendation engine that addresses both the scale gracefully to large codebases and the global statistics of code repositories in the ranking function, such as the distribution of code snippet lengths, leads to sub-optimal retrieval results.","ArXiv",2021,"Fran Silavong,S. Moran,Antonios Georgiadis,Rohan Saphal,R. Otter",0,48,0,"https://www.semanticscholar.org/paper/0c7cb854756f6b69f070a925cd497c2970b136f2"
"21363c1ac138d8df80b20af4848b5113bd3bf6f8",1,"Clone-advisor: recommending code tokens and clone methods with deep learning and information retrieval","This paper applies an information retrieval technique on top of DeepClone output to recommend real clone methods closely matching the predicted clone method, thus improving the original output by DeepClones.","PeerJ Computer Science",2021,"Muhammad Hammad,Önder Babur,H. Basit,M. Brand",1,107,1,"https://www.semanticscholar.org/paper/21363c1ac138d8df80b20af4848b5113bd3bf6f8"
"58b142663367ef6ed67507e3d7591b6e384a6937",1,"Deep Distilling: automated code generation using explainable deep learning","Deep distilling is introduced, a machine learning method that learns patterns from data using explainable deep learning and then condenses it into concise, executable computer code that generalizes out-of-distribution to solve problems orders of-magnitude larger and more complex than the training data.","ArXiv",2021,"Paul J. Blazek,Kesavan Venkatesh,M. Lin",1,20,0,"https://www.semanticscholar.org/paper/58b142663367ef6ed67507e3d7591b6e384a6937"
"4e7de32c8da8c910285acdaf397347dc94ca3594",1,"Many Heads but One Brain: Fusion Brain -- a Competition and a Single Multimodal Multitask Architecture","The proposed Fusion approach proves to be competitive and more energy-efﬁcient compared to the task- speci⬁c one.","",2021,"Daria Bakshandaeva,Denis Dimitrov,Alex Shonenkov,M. Potanin,V.Ya. Arkhipkin,Denis Karachev,Vera Davydova,Anton Voronov,Mikhail Martynov,Natalia Semenova,Mikhail Stepnov,Elena Tutubalina,Andrey Chertok,Aleksandr Petiushko",0,50,0,"https://www.semanticscholar.org/paper/4e7de32c8da8c910285acdaf397347dc94ca3594"
"7fba3100768fa3aac0fbf961d5e894b2f629e6e6",1,"Federated Data Science to Break Down Silos [Vision]","KEK is proposed, an open federated data science platform that does not only allow for sharing data science pipelines and their (meta) data but also provides methods for efficient search and, in the ideal case, even allows for combining and defining pipelines across platforms in a federated manner.","SIGMOD record",2021,"Essam Mansour,Kavitha Srinivas,K. Hose",4,42,0,"https://www.semanticscholar.org/paper/7fba3100768fa3aac0fbf961d5e894b2f629e6e6"
"eeadabea580953c14bb00ca99b41ee9b2cef6300",1,"Energy-bounded Learning for Robust Models of Code","This paper proposes the use of an energy-bounded learning objective function to assign a higher score to in-distribution samples and a lower score to out-of-distributed samples in order to incorporate such out- of-dist distribution samples into the training process of source code models.","ArXiv",2021,"Nghi D. Q. Bui,Yijun Yu",1,70,0,"https://www.semanticscholar.org/paper/eeadabea580953c14bb00ca99b41ee9b2cef6300"
"d4f16dae4ab1d21db3c0b0bd7b54f4b62e2d1b85",1,"The Effectiveness of Transformer Models for Analyzing Low-Level Programs","It is shown that transformer models can translate C to LLVM-IR with high accuracy, by training on a parallel corpus of functions extract from 1 million compilable, open-sourced C programs (AnghaBench) and its corresponding LL VM-IR after compiling with Clang.","",2022,"Zifan Carl,William S. Moses",0,39,0,"https://www.semanticscholar.org/paper/d4f16dae4ab1d21db3c0b0bd7b54f4b62e2d1b85"
"7d500d6bd3ae49fa3acb213fd25d5b11566e64fd",1,"Labeling-Free Comparison Testing of Deep Learning Models","A labeling-free comparison testing approach to overcome the limitations of labeling effort and sampling randomness and learns a Bayesian model to infer the models’ specialty only based on predicted labels.","ArXiv",2022,"Yuejun Guo,Qiang Hu,Maxime Cordy,Xiaofei Xie,Mike Papadakis,Yves Le Traon",0,37,0,"https://www.semanticscholar.org/paper/7d500d6bd3ae49fa3acb213fd25d5b11566e64fd"
"b2c0e903b79835b6ee8fd553c2213ea8abbf7864",1,"Senatus - A Fast and Accurate Code-to-Code Recommendation Engine","De-Skew LSH a new locality sensitive hashing (LSH) algorithm that indexes the data for fast (sub-linear time) retrieval while also counteracting the skewness in the snippet length distribution using novel abstract syntax tree-based feature scoring and selection algorithms is developed.","IEEE Working Conference on Mining Software Repositories",2021,"Fran Silavong,S. Moran,Antonios Georgiadis,Rohan Saphal,R. Otter",0,56,0,"https://www.semanticscholar.org/paper/b2c0e903b79835b6ee8fd553c2213ea8abbf7864"
"9f0852ce9338c00135fe39426d893a36a289e5d5",1,"GraphCode2Vec: Generic Code Embedding via Lexical and Program Dependence Analyses","Graphcode2vec, the first self-supervised pre-training approach which produces task-agnostic embedding of lexical and program dependence features, is proposed and demonstrated to be more effective than both generic and task-specific learning-based baselines.","IEEE Working Conference on Mining Software Repositories",2021,"Wei Ma,Mengjie Zhao,Ezekiel O. Soremekun,Q. Hu,Jie Zhang,Mike Papadakis,Maxime Cordy,Xiaofei Xie,Yves Le Traon",7,78,0,"https://www.semanticscholar.org/paper/9f0852ce9338c00135fe39426d893a36a289e5d5"
"7438626a757c5442b9c0fb37b54ec0fe7e1889c3",1,"Better Together? An Evaluation of AI-Supported Code Translation","This work motivates the need for intelligent user interfaces that help software engineers effectively work with generative code models in order to understand and evaluate their outputs and achieve superior outcomes to working alone.","International Conference on Intelligent User Interfaces",2022,"Justin D. Weisz,Michael J. Muller,Steven I. Ross,Fernando Martinez,Stephanie Houde,Mayank Agarwal,Kartik Talamadupula,John T. Richards",7,103,0,"https://www.semanticscholar.org/paper/7438626a757c5442b9c0fb37b54ec0fe7e1889c3"
"4b27f18bff43d605805c92696a979714ced0b805",1,"UniXcoder: Unified Cross-Modal Pre-training for Code Representation","Results show that the model achieves state-of-the-art performance on most tasks and analysis reveals that comment and AST can both enhance UniXcoder.","Annual Meeting of the Association for Computational Linguistics",2022,"Daya Guo,Shuai Lu,Nan Duan,Yanlin Wang,Ming Zhou,Jian Yin",42,36,10,"https://www.semanticscholar.org/paper/4b27f18bff43d605805c92696a979714ced0b805"
"8c8bf30828bc789be679f29ee08cc6cdebd36600",1,"Characterizing and Understanding the Behavior of Quantized Models for Reliable Deployment","This study considers 4 datasets spanning from image to text, 8 DNN architectures including feed-forward neural networks and recurrent neural networks, and 42 shifted sets with both synthetic and natural distribution shifts and reveals that data with distribution shifts happen more disagreements than without.","ArXiv",2022,"Qiang Hu,Yuejun Guo,Maxime Cordy,Xiaofei Xie,Wei Ma,Mike Papadakis,Yves Le Traon",1,64,0,"https://www.semanticscholar.org/paper/8c8bf30828bc789be679f29ee08cc6cdebd36600"
"5e5a7f8423e0b990bbe1c85a999da86f16ee68a3",1,"LaF: Labeling-Free Model Selection for Automated Deep Neural Network Reusing","A labeling-free (LaF) model selection approach to overcome the limitations of labeling efforts for automated model reusing and statistically learn a Bayesian model to infer the models’ specialty only based on predicted labels.","",2022,"Qiang Hu,Yuejun Guo,Maxime Cordy,Xiaofei Xie,Mike Papadakis,Yves Le Traon",0,46,0,"https://www.semanticscholar.org/paper/5e5a7f8423e0b990bbe1c85a999da86f16ee68a3"
"1413acc991434ee36248b282b4cedac77ade1737",1,"Evaluating few shot and Contrastive learning Methods for Code Clone Detection","This research assesses the generalizability of the state of the art models for CCD in few shot settings and employs Model Agnostic Meta-learning (MAML), where the model learns a meta-learner capable of extracting transferable knowledge from the train set so that the model can be fine-tuned using a few samples.","ArXiv",2022,"Mohamad Khajezade,F. Fard,M. Shehata",1,49,0,"https://www.semanticscholar.org/paper/1413acc991434ee36248b282b4cedac77ade1737"
"c765091cb8bec8448669351f3662101c307c03c4",1,"Zero-Shot Program Representation Learning","Zecoler is a zero-shot learning approach for code representations built upon a pre-trained programming language model that significantly outperforms baseline models in both zero- shot and few-shot settings.","IEEE International Conference on Program Comprehension",2022,"Nan Cui,Yuze Jiang,Xiaodong Gu,Beijun Shen",0,43,0,"https://www.semanticscholar.org/paper/c765091cb8bec8448669351f3662101c307c03c4"
"80b2b006ed2f26ec3ddc91e303dc9861fb456a26",1,"On The Cross-Modal Transfer from Natural Language to Code through Adapter Modules","Studying the bimodality of adapters for two tasks of cloze test and code clone detection, compared to their benchmarks from the CodeXGLUE platform confirms the success of the adapters in knowledge transfer to software engineering, which sometimes are in par with or exceed the results of a PTLM trained on source code while being more efficient in terms of the number of parameters, memory usage, and inference time.","IEEE International Conference on Program Comprehension",2022,"Divyam Goel,Raman Grover,F. Fard",0,37,0,"https://www.semanticscholar.org/paper/80b2b006ed2f26ec3ddc91e303dc9861fb456a26"
"c1ddf0006e1aa0d5551e1ba1ad734ec0ecf27fd0",1,"CV4Code: Sourcecode Understanding via Visual Code Representations","This work presents CV4Code, a compact and effective computer vision method for sourcecode understanding that leverages the contextual and the structural information available from the code snippet by treating each snippet as a two-dimensional image, which naturally encodes the context and retains the underlying structural information through an explicit spatial representation.","ArXiv",2022,"Ruibo Shi,Lili Tao,Rohan Saphal,Fran Silavong,S. Moran",0,30,0,"https://www.semanticscholar.org/paper/c1ddf0006e1aa0d5551e1ba1ad734ec0ecf27fd0"
"6fb1a9d5278b85dfbbb0be3731d480ab36a0372e",1,"CodeAttack: Code-based Adversarial Attacks for Pre-Trained Programming Language Models","This work proposes, CodeAttack, a simple yet effective black- box attack model that uses code structure to generate effective, efﬁcient, and imperceptible adversarial code samples and demonstrates the vulnerabilities of the state-of-the-art PL models to code-species adversarial attacks.","ArXiv",2022,"Akshita Jha,C. Reddy",3,41,0,"https://www.semanticscholar.org/paper/6fb1a9d5278b85dfbbb0be3731d480ab36a0372e"
